ID,Term_Description,Fold_Enrichment,occurrence,support,lowest_p,highest_p,Up_regulated,Down_regulated
GO:0002250,adaptive immune response,1.5484917288355498,10,0.14285714285714285,0.009705438899861968,0.01588518170446005,"BTK, CTSL, CTSS, CX3CR1, HLA-E, ITK, PIK3CD, PIK3CG, ZAP70","RAP1GAP, RIPK2, TNFRSF11A, BCL10, RAPGEF4"
GO:0034446,substrate adhesion-dependent cell spreading,1.131590109533671,4,0.125,0.01012082283559338,0.012813888586924404,"RHOA, FN1, ITGAV, ITGB3, LAMB1, LAMC1, RAC1, TEK, ITGA8, BVES, SRGAP2, PARVA, FERMT3",TYRO3
GO:0043406,positive regulation of MAP kinase activity,1.3850956860201105,1,0.14285714285714285,0.010156123390623346,0.010156123390623346,"ADRA2A, DRD4, EDN1, FGF1, FGF2, FGFR1, FLT3, GHR, HTR2B, NTRK3, PDGFA, PDGFB, PDGFRB, PIK3CG, THBS1, FGF18, RASGRP1, PIK3R5, LRRK2, IL34, PIK3R6","ERBB2, EZH2, FLT1, HRAS, IL1B, INSR, MST1R, CD24"
GO:0032587,ruffle membrane,1.0927927343496595,1,0.125,0.010430080370926353,0.010430080370926353,"FGR, ITGA5, ITGAV, ITGB1, ITGB3, RAC1, TPM1","APC, NME1, RPS3, ADAM17, PIP5K1A, TRPV4"
GO:1904707,positive regulation of vascular associated smooth muscle cell proliferation,0.9246707752189426,9,0.14285714285714285,0.01404522471989098,0.032971443768250196,"FGF2, HTR1B, IGF1, IL10, JUN, MEF2D, MMP2, MMP9, PDGFB","DNMT1, MFN2"
GO:0060326,cell chemotaxis,1.4260344747694733,9,0.14285714285714285,0.014900547982309291,0.023578904534633335,"AGTR1, RHOG, ARRB2, LPAR1, EPHB1, PDGFB, PDGFRA, PDGFRB, CCL21, CX3CL1, CXCL12, BCAR1, LEF1, CCL28","ABCC1, PLXNB3, PRKCD, CCL20, PIP5K1A"
GO:2000811,negative regulation of anoikis,1.2932458394670525,2,0.125,0.015268701201353305,0.01625174677616184,"BCL2, CAV1, ITGA5, ITGB1, PDK4","PTK2, SRC, ZNF304"
GO:0048870,cell motility,1.7782130292671972,5,0.14285714285714285,0.015268701201353305,0.019483121289890225,"ACTB, CD34, ETS1, MMP14, ENPP2, RAC1, TGFBR1, ELMO1","CTTN, PTK2, ADAM17"
GO:0045121,membrane raft,1.1084964338289023,1,0.14285714285714285,0.016405921420938073,0.016405921420938073,"ADCY2, ANGPT1, APP, FAS, ATP2B4, BTK, CAV1, CD4, CD14, CD48, CD79A, CD55, DMD, FYN, IL6ST, ITGB1, LCK, LYN, PTPRC, RAP1B, TEK, TGFBR1, TGFBR2, TLR1, TNFRSF1B, LAT2, ZAP70, PLPP3, HYAL2, TLR6, SORBS1, CD226, GP6, AHNAK","EMP2, LDHB, PPP2CA, PPP2R1B, SHH, SLC9A1, SRC, ADAM17, TNFRSF11A, TNFRSF10A, LAT, ASAH2, CARD11, CD24"
GO:0006935,chemotaxis,1.2342286682215322,1,0.125,0.01663849386123151,0.01663849386123151,"C5, C5AR1, CCR4, CCR5, CCR8, CX3CR1, S1PR1, FGF2, FPR2, CXCR3, NCKAP1L, CXCL10, CXCL9, PLAU, PLAUR, CCL2, CCL7, CCL8, CCL11, CCL13, CCL18, CCL23, CX3CL1, CXCL12, SPN, CCL26, CCL28, CCR2","CXCL1, HRAS, CXCL8, PLD1, MAP2K1, CCL20, FOSL1, RALBP1, LTB4R2"
GO:0050731,positive regulation of peptidyl-tyrosine phosphorylation,1.3295359012888321,1,0.14285714285714285,0.019359194068896936,0.019359194068896936,"ABL1, ACVR1, ANGPT1, BMP6, CD80, CD74, FGF7, FGF10, GHR, HCLS1, IGF1, IL6, IL11, ITGA5, ITGB3, LIF, OSM, ENPP2, PECAM1, PTPRC, PTPRJ, THBS4, VTN, TREM2, BANK1","DGKQ, EFNA5, SRC, VEGFA, RIPK2, ANGPT4"
GO:0004175,endopeptidase activity,1.1768537139150177,2,0.125,0.019873007666038955,0.0274465281678006,"CMA1, MMP2, MMP3, MMP7, MMP9, MMP13, MMP14, BACE1","MMP1, SHH, ADAM17, ZMPSTE24, ATG4B, PIDD1"
GO:0060307,regulation of ventricular cardiac muscle cell membrane repolarization,1.3373337658125202,4,0.15476190476190477,0.024560556486494366,0.033443439506853856,"ANK2, CACNA2D1, KCNE1, SCN1B, SCN4B, SNTA1",NOS1AP
GO:0060048,cardiac muscle contraction,1.1878181895104996,6,0.14285714285714285,0.02542866912302192,0.04388168154559292,"ATP1A2, CASQ2, DMD, MYBPC3, MYL3, MYL4, RYR2, SCN1B, SCN4B, SLC8A1, TPM1","GRK2, ATP1B1"
GO:0045669,positive regulation of osteoblast differentiation,1.2361908759611533,3,0.125,0.02905282101363449,0.03849761920170482,"ACVR1, BMP4, BMP6, BMPR2, RUNX2, IGF1, IL6, IL6ST, MEF2C, PPP3CA, PRKD1, FZD1, WWTR1, WNT4","ACVR2B, BMPR1B, LRP5, SMAD5, WNT7B, FBXO5"
GO:0032729,positive regulation of type II interferon production,1.3195618885259752,1,0.14285714285714285,0.030438456713519878,0.030438456713519878,"CD2, CD14, HLA-DPA1, HLA-DPB1, IL1R1, IL12RB1, PDE4B, PDE4D, TNFSF4, IL18R1, RASGRP1, EBI3, LILRB1, TLR8, CLEC7A, IL27, CCR2","CEBPG, F2RL1, HSPD1, IL1B, IL12A, TYK2, FZD5, SCRIB, IL23A, CD244"
GO:0007179,transforming growth factor beta receptor signaling pathway,1.3336597719503978,2,0.125,0.03297038336914567,0.03923546858607669,"ACVR1, ACVRL1, ARRB2, CDH5, COL1A2, COL3A1, DAB2, LRRC32, ITGB1, ITGB5, JUN, STAT3, TGFB3, TGFBR1, TGFBR2, CLDN5, ZYX, NRROS","APOA1, FNTA, GDF9, HPGD, ID1, SMAD2, SMAD3, PTK2, PXN, SRC, MAP3K7, ZFYVE9, GDF15, USP15, NLK"
GO:0010881,regulation of cardiac muscle contraction by regulation of the release of sequestered calcium ion,1.401016326089307,5,0.14285714285714285,0.033235470847729015,0.04960868295736817,"ANK2, ATP1A2, CACNA1C, CASQ2, DMD, RYR2, SLC8A1",HRC
GO:0017147,Wnt-protein binding,1.7074886474213429,10,0.14285714285714285,0.03347091356316289,0.04842862040212816,"FRZB, ROR1, ROR2, SFRP1, SFRP4, FZD1, FZD7, FZD9","LRP5, FZD5, FZD3, FZD6, APCDD1"
GO:0004672,protein kinase activity,1.242640567487907,1,0.16666666666666666,0.035534421588091294,0.035534421588091294,"ABL1, ABL2, ACVR1, MAP3K3, PDGFRA, PDGFRB, PDK4, PIK3CG, PRKG1, CCL2, CCL5, CCL8, TEK, TGFBR1, MAP3K14, MAPKAPK2, AKT3, PRKD2, PINK1, LRRK2","GRK2, AKT1, ATR, BRAF, BUB1, CAD, CDK1, CDK7, CHEK1, CSNK1D, CSNK1E, CSNK1G3, DAPK1, MTOR, GSK3B, IKBKB, MAP3K5, MAP3K11, PAK1, PDK1, PDK3, PLK1, PRKAA1, PRKAG1, PRKCD, PKN2, PRKCZ, PRKDC, PRKG2, MAP2K1, RAF1, RPS6KA3, RPS6KB1, MAP2K4, SRC, SRPK1, AURKA, MAP4K3, CDK5R1, SMG1, RPS6KA6, HIPK2, NLK, STRADB, TAOK1, WNK3, STRADA, MAPK15"
GO:0032956,regulation of actin cytoskeleton organization,1.3326740662800725,2,0.15476190476190477,0.03747307365205139,0.04870861103150069,"ABL1, ABL2, RHOA, BST1, CSF1R, DAPK3, EPHA3, HCK, LRP1, PDGFA, PDGFRA, PDGFRB, IQGAP2, DAAM2, ESAM","CRK, DVL2, DVL3, EFNA5, MTOR, HRAS, PRKCD, EZR, TAOK2, TAOK1, RICTOR"
GO:0030574,collagen catabolic process,2.1015244891339604,4,0.13392857142857142,0.037949998091214285,0.049248495277064805,"CTSB, CTSK, CTSL, CTSS, MMP2, MMP3, MMP7, MMP9, MMP13, MMP14, PRSS2, MRC2","MMP1, MMP15"
GO:0016301,kinase activity,1.1408275798155785,1,0.14285714285714285,0.046750948504165356,0.046750948504165356,"ABL1, CAMK2A, PIK3CD, PIK3CG, PRKD1, PINK1, LRRK2","AKT1, CDK1, CSNK2A1, DGKA, MTOR, GSK3B, PIK3C3, PKN2, CDK5R1, STK39, TAOK1, MAPK15"
GO:0032757,positive regulation of interleukin-8 production,1.1102393527500167,1,0.14285714285714285,0.047761911360268326,0.047761911360268326,"CD2, CD14, CD74, F2R, IL6, LBP, SERPINE1, STAT3, TLR1, TLR5, HYAL2, NOD1, LILRA2, PRKD2, TLR8, IL17D, CLEC7A","APOA2, CD58, F2RL1, HMGB1, HSPA1B, IL1B, NOS2, BCL10, LAMTOR5, CD244, MAVS"
GO:0046875,ephrin receptor binding,1.112571788365038,1,0.14285714285714285,0.049336967356864006,0.049336967356864006,"ABL1, FYN, LYN, PIK3CG","CRK, EFNA4, EFNA5, EFNB1, SRC"
