ID,Term_Description,Fold_Enrichment,occurrence,support,lowest_p,highest_p,Up_regulated,Down_regulated
GO:0005080,protein kinase C binding,1.310212335692619,10,0.07692307692307693,2.470092802139809e-4,7.111368985973697e-4,"ADCY6, GRK5, PRKCB, ADAM9, ADCY4","ABL1, HSPB1, IRS1, ITGAV, YWHAG, PRKD2, UGT1A7, TRPV4"
GO:0035556,intracellular signal transduction,1.2726647725279738,10,0.07692307692307693,5.251903320695908e-4,0.00637365380075931,"BLK, BTK, DAPK1, FYN, CXCL1, JAK2, JAK3, LCK, PRKAR2A, RAC1, SRC, STK4, TCL1A, CAMK1, RIPK1, RAPGEF2, RAPGEF3, SIK2, DAPK2, STK39, BLNK, PLCE1, SIRPG, WNK4","CRKL, DAPK3, FER, MKNK2, GSK3B, HSPB1, STMN1, SMAD2, MC1R, MAP3K4, PRKAR1A, PRKAR2B, PRKD1, RAC3, STK3, TFRC, TGFA, TGFBR1, LAT2, YWHAE, HMGA2, MKNK1, SPHK1, MAP4K4, RRAGA, PDCD10, PRKD2, LAT, DDIT4, NOD2, WNK1, WNK3"
GO:0048010,vascular endothelial growth factor receptor signaling pathway,1.214226083993526,4,0.07417582417582418,0.00412038032885072,0.04643291239098668,"FLT4, FYN, KDR, SRC, VAV1, MAPKAPK3","HSPB1, PAK2, PRKD1, VEGFC, PRKD2"
GO:0001934,positive regulation of protein phosphorylation,1.1822146690518784,4,0.07692307692307693,0.0064108819141088,0.04605732824807927,"ACVR2A, ARRB1, BMP4, C3, CCND3, CD4, CD74, CHRNA7, CLDN3, CSF1R, CSNK1D, FLT4, GPER1, HLA-DRB1, ILK, INSR, KDR, KRAS, LYN, NTRK3, PECAM1, RAC1, SOX9, STK4, TEK, AXIN2, RIPK1, MAVS, RSPO1","ABL1, ANGPT1, CCND1, CDKN1A, CRKL, DVL2, DVL3, EFNA1, EGFR, HRAS, HSP90AA1, LEP, LIMK2, NKX3-1, NTRK2, P2RY1, PIN1, RALB, TFRC, HDAC3, RALBP1, WNT3A"
GO:0045766,positive regulation of angiogenesis,1.3055785166450762,2,0.06512605042016806,0.02213327557947355,0.02213327557947355,"APLNR, AQP1, CD34, CDH5, CHRNA7, CCR3, CTSH, ETS1, GATA4, HYAL1, ITGAX, KDR, NOS3, PRKCA, PRKCB, RRAS, TEK, XBP1, FGF18, RAMP2, RAPGEF3, HIPK2, ADM2, PIK3R6","RHOB, BTG1, RUNX1, EMP2, FGF1, FGF2, HIF1A, HK2, HSPB1, IL1A, ITGB8, NODAL, SERPINE1, PIK3CD, PLCG1, PRKD1, SFRP2, STIM1, THBS1, WNT5A, HMGA2, SPHK1, PRKD2, ANGPTL3, WNK1"
GO:0005856,cytoskeleton,1.3588674356918142,1,0.07692307692307693,0.03588957942053149,0.03588957942053149,"BIN1, ARHGDIB, CASP8, CR1, DGKQ, FGR, ITPKA, P4HB, MAPK3, SNAP25, ARHGEF2, SPRY2, PARVG","CALD1, CTTN, HIP1, HSPB1, ITPKB, KRT16, LLGL1, MSN, NEFH, NF2, NOS1, MAPK1, TPM4, TRIP6, TUBA4A, VCL, DYNLL1, WASF1, HAP1, HTRA2, NOD2"
