ID,Term_Description,Fold_Enrichment,occurrence,support,lowest_p,highest_p,Up_regulated,Down_regulated
GO:0048010,vascular endothelial growth factor receptor signaling pathway,1.4972038637519065,10,0.18181818181818185,3.439235169650597e-6,2.0785124842671849e-4,"MAPK14, FLT1, FLT4, FYN, KDR, PAK2, VAV1, VEGFC, NRP1, BCAR1, PRKD2","HSPB1, PRKD1, PTK2, SRC"
GO:0032755,positive regulation of interleukin-6 production,1.3185053380782918,10,0.11688311688311688,1.9401358560912623e-5,0.02379893167018812,"APP, CD74, CYBA, F2R, F2RL1, HMGB1, IL16, LPL, MYD88, NOS2, PLCG2, MAPK13, SYK, TGFB1, TLR2, TLR4, TWIST1, TNFSF4, TYROBP, WNT5A, XBP1, HYAL2, TLR6, LILRA2, IL17RA, PYCARD, TLR8, IL17D, CARD9, CLEC7A, LILRA5","HSPD1, IL1A, IL1B, IL6R, PTPN11, TSLP, TIRAP, MIR92A1"
GO:0032729,positive regulation of type II interferon production,1.5111313415542498,10,0.08333333333333333,2.534788776148672e-5,6.06242816863633e-5,"CD2, CD14, F2RL1, HLA-A, HLA-DPA1, HLA-DPB1, IL1R1, IL12RB1, IL12RB2, IL18, TLR4, TNFSF4, TXK, TYK2, IL18R1, ISG15, RASGRP1, EBI3, LILRB1, PYCARD, TLR7, TLR8, CLEC7A, IL27, CCR2","CEBPG, HSPD1, IL1B, PDE4B, PDE4D, SCRIB"
GO:0009615,response to virus,1.2346804465460928,9,0.08333333333333333,6.663886153983891e-4,0.03765239222193704,"BCL3, BST2, CDK6, CFL1, AP1S1, FGR, GATA3, HYAL1, IFNAR1, IFNAR2, IFNGR1, IFNGR2, IRF7, MX2, OAS1, OAS2, CCL4, CCL5, CCL8, CCL19, XCL1, CXCL12, SMPD1, TNFSF4, CXCR4, FOSL1, HMGA2, HYAL2, ISG15, LAMTOR5, LILRB1, PIM2, IL17RA, TBX21, FOXP3, TLR8","ACTA2, CHRM2, DDX3X, HSPB1, IKBKB, ODC1, HYAL3"
GO:0035556,intracellular signal transduction,1.3151908450212828,6,0.08712121212121213,0.00683107145848913,0.02987461652302191,"ADRA1B, BTK, MAPK14, FYN, HCK, HCLS1, HMOX1, JAK3, LCK, MAP3K3, NFATC1, NOTCH2, PLCG2, PRKAR1A, RAC1, RAC3, SYK, TGFA, TGFBR1, TYROBP, LAT2, YWHAE, HMGA2, MKNK1, RIPK1, RPS6KA4, MAP4K4, RAPGEF2, NOD1, RAPGEF3, PRKD2, LATS2, PLCE1, DDIT4, SIRPG","ADRA1A, DAPK3, DDX3X, GSK3B, HSPB1, SMAD4, MAP3K4, MTCP1, PDPK1, PLCL1, PRKAR2A, PRKD1, SRC, STK3, TFRC, MAP3K12, CAMK1, SQSTM1, RPS6KA5, OXSR1, MAP3K2, PDCD10, LAT, STK39, PRKAG2, WNK4, WNK2, DAB2IP, FLCN"
GO:0043536,positive regulation of blood vessel endothelial cell migration,1.0236696184722338,7,0.09090909090909093,0.00741304860104339,0.01432718362347131,"CD40, MAPK14, ETS1, FGFR1, HMGB1, KDR, NOS3, PDGFB, MAP2K3, STAT5A, ADAM17, TGFB1, TMSB4X, FGF18, PRKD2","FGF2, HSPB1, PDPK1, PRKD1, SP1, AKT3"
GO:0044877,protein-containing complex binding,1.3251114656195035,1,0.07692307692307693,0.01803921518618692,0.01803921518618692,"APOE, CD36, CNTF, DDB2, EPHB2, FCGR2B, GNB1, GNB2, NCKAP1L, KRAS, LRP1, CIITA, MYC, NDUFA9, NRAS, NSF, RAC1, RAP1B, TLR2, TSHR, FZD4, RIPK1, CIR1, SPATA2, LILRB2, NOD1, RIPK3, PARK7, VPS4A, TREM2, GNB4, ATG101, DERL1, CHMP6, SESN2, MLKL","ADRB2, CAV1, CDKN1B, CRYAB, DDB1, ITGA2, NDUFA4, PCNA, PEX1, PFKP, RAP1A, TFRC, ULK1, DEPDC5, RPTOR, DAB2IP, PGAM5, FLCN, CRB2"
GO:0032760,positive regulation of tumor necrosis factor production,1.2898987133862578,3,0.07692307692307693,0.01815302100462853,0.02593872443500683,"APP, CD2, CD14, TNFRSF8, CYBA, EPHB2, FCGR3A, HLA-E, HMGB1, IFNGR1, LPL, OAS1, OAS2, PLCG2, PSEN1, PTPRC, PTPRJ, CCL3, CCL19, SPN, SYK, TGFB1, TLR2, TLR4, TWIST1, TYROBP, WNT5A, RIPK1, RASGRP1, LILRA2, LY96, PYCARD, CLEC7A, HAVCR2, LILRA5, CCR2","HSPB1, IL1A, PTPN11, TIRAP"
GO:1990782,protein tyrosine kinase binding,1.3973902728351126,1,0.08333333333333333,0.04860799052481168,0.04860799052481168,"CD247, CD4, CDH5, CRK, PLCG2, SH2B3, NOX4, TREM2, SIRPA","ACVR1, DUSP3, HSP90AA1, PTPN11, TJP2"
