ID,Term_Description,Fold_Enrichment,occurrence,support,lowest_p,highest_p,Up_regulated,Down_regulated
GO:0008286,insulin receptor signaling pathway,1.5076207097149505,5,0.16666666666666666,0.02902630072535429,0.047693692182714506,"FER, GAB1, IGF1R, INSR, PDK2, PIK3C2A, PIK3CA, IRS2, BCAR1, BAIAP2, RHOQ, APPL1","AKT1, APC, GPLD1, GSK3A, PDK4, PTPN2, SORBS1, SH2B2"
GO:0030165,PDZ domain binding,1.5963042808746537,1,0.14285714285714285,0.031583860319158795,0.031583860319158795,"ACOX1, CFTR, FZD2, LLGL2, PRKN, SDC2, ADAM17, FZD4, FZD7, FZD8, ARHGAP29, RAPGEF2, DOCK4, NLGN1, KIDINS220, CXXC4","NSF, PTEN, SLC22A4, SLC22A5, SSTR2, NHERF1, F11R, SRR"
GO:0018105,peptidyl-serine phosphorylation,1.130715532286213,1,0.2,0.03219529441669785,0.03219529441669785,"ATR, CSNK2A2, PRKACA, PRKCD, PRKCE, PRKD1, RPS6KB1, TGFBR1, ROCK2, HIPK3, PLK2, PINK1","GRK2, AKT1, CAMK2B, CDK5, DGKQ, MTOR, GSK3B, IKBKB, MAP3K10, RPS6KA3, MAPK12, AURKA, MKNK1, CDK5R1, MAPKAPK2, MAP4K1, PRKD2, STK39, CAB39"
GO:0030168,platelet activation,1.227634006482174,1,0.14285714285714285,0.03659225594789968,0.03659225594789968,"F2R, GP1BA, PIK3CA, VWF, F2RL3","CD40LG, CTSG, DGKA, DGKB, DGKG, DGKQ, F2RL2, IL6, PIK3CB, PPIA, SRC, SYK, DGKZ, VAV3"
GO:0019221,cytokine-mediated signaling pathway,0.9950296684118674,1,0.16666666666666666,0.04341363880028734,0.04341363880028734,"CSF1R, FER, IL7, JAK1, PRKACA, TNFRSF1A, TYK2, SOCS5, DUOX2, GREM2","AKT1, CTSG, EDN2, FLT3, HCK, IL6, IL6R, IL12RB1, JAK2, PIK3R1, PTPN6, IL31RA"
GO:0034237,protein kinase A regulatory subunit binding,1.6960732984293194,1,0.16666666666666666,0.045635090304218535,0.045635090304218535,"KCNQ1, PRKACA, RYR2",
