ID,Term_Description,Fold_Enrichment,occurrence,support,lowest_p,highest_p,Up_regulated,Down_regulated
GO:0018108,peptidyl-tyrosine phosphorylation,1.5443919465372666,10,0.3333333333333333,3.795103520237824e-13,1.3678659490621087e-8,"ABL1, CSF1R, EPHA4, ERBB2, ERBB4, FER, FGFR1, FLT1, FLT4, INSR, KDR, PDGFB, PDGFRA, ABI2","ABL2, EPHA1, EPHB2, PTK2B, FLT3, FYN, HCK, JAK2, JAK3, NTRK1, RELN, PTPN6, SRC, SYK"
GO:0004713,protein tyrosine kinase activity,1.3383979769918437,10,0.3333333333333333,6.420467150278841e-12,2.919557921064485e-9,"ABL1, AXL, CSF1R, EPHA4, ERBB2, ERBB3, ERBB4, FGFR1, IGF1R, INSR, JAK1, KDR, MET, RYK, TYK2, YES1","ABL2, CSK, EPHB2, PTK2B, FLT3, FYN, HCK, JAK2, JAK3, MET, NTRK1, RET, SRC, SYK"
GO:0005604,basement membrane,1.6960732984293194,7,0.16666666666666666,6.545457858401875e-12,1.2289293120087846e-9,"COL4A3, DAG1, LAMA2, LAMA4, LAMA5, LAMB2, LAMC1, THBS4, FRAS1, LAMA1, AGRN",LAMA3
GO:0046777,protein autophosphorylation,1.3020360674810936,10,0.24285714285714285,1.078574437919694e-11,3.0641839958990926e-8,"ABL1, ACVR1B, ATR, CSF1R, EPHA4, EPHB1, EPHB3, ERBB4, FER, FGFR1, FLT1, FLT4, IGF1R, INSR, KDR, PDGFRA, PDPK1, PRKD1, GRK1, ULK2, SLK, CHEK2, SIK2, MAP3K20, TAOK1, MYLK2, MAPK15, EIF2AK4","AKT1, CAD, CAMK2B, EPHA1, PTK2B, FLT3, MTOR, GRK5, GSK3B, HCK, INSRR, IRAK1, JAK2, MAP3K9, MAP3K10, MAP3K11, NTRK1, NTRK2, SRC, AURKA, TXK, TAOK2, MAP4K1, PRKD2, EIF2AK1, STK39, TAOK3, WNK3, SIK1"
GO:0007229,integrin-mediated signaling pathway,1.3568586387434554,7,0.16666666666666666,2.5559694349749335e-11,4.1399706221290767e-7,"ABL1, CD47, DOCK1, FN1, ILK, ITGA2, ITGAV, ITGB1, ITGB5, ITGB8, LAMA5, PRKD1, THY1, NRP1, BCAR1, LAT","CD40LG, COL3A1, PTK2B, HCK, ITGB2, ITGB7, SRC, SYK, SEMA7A, PLPP3, ITGA11"
GO:0005747,mitochondrial respiratory chain complex I,1.249738219895288,10,0.16666666666666666,3.271695055188803e-11,1.1202948284261627e-5,,"NDUFA1, NDUFA2, NDUFA4, NDUFA5, NDUFA6, NDUFA8, NDUFA10, NDUFAB1, NDUFB1, NDUFB3, NDUFB4, NDUFB5, NDUFB6, NDUFC1, NDUFS1, NDUFS2, NDUFS3, NDUFV2, NDUFA13, NDUFA12, NDUFS7"
GO:0004714,transmembrane receptor protein tyrosine kinase activity,1.5547338568935427,10,0.3333333333333333,3.8339298839892584e-11,4.782285671235884e-7,"EPHA2, ERBB2, ERBB4, FLT1, FLT4, KDR, PDGFRA","FLT3, INSRR, NTRK1, RET"
GO:0032981,mitochondrial respiratory chain complex I assembly,1.3427246945898779,10,0.16666666666666666,9.929028980090344e-11,2.0825491977710312e-6,,"NDUFA1, NDUFA2, NDUFA5, NDUFA6, NDUFA8, NDUFA10, NDUFAB1, NDUFB1, NDUFB3, NDUFB4, NDUFB5, NDUFB6, NDUFC1, NDUFS1, NDUFS2, NDUFS3, TAFAZZIN, NDUFA13, NDUFS7"
GO:0007169,cell surface receptor protein tyrosine kinase signaling pathway,1.7229950968170864,10,0.3333333333333333,7.464814696249415e-8,2.0785124842671846e-4,"CSF1, CSF1R, ERBB2, ERBB3, ERBB4, FLT1, FLT4, KDR, NRTN, NTF3, NTRK3","BDKRB2, FLT3, PIK3CB, ABI1, PILRB"
GO:0062023,collagen-containing extracellular matrix,1.469930191972077,7,0.16666666666666666,2.1081382755932913e-7,7.042843289586132e-6,"COL4A1, COL4A2, COL6A2, DCN, F3, FN1, LAMA4, LAMB2, LAMC1, LTBP1, SFRP2, TGFB2, THBS4, VWF, WNT2, CDON, NPNT, LAMA1, AGRN","ANXA2, COL3A1, FGF10, TNC, LUM, SERPINE2, SFRP1"
GO:0051092,positive regulation of NF-kappaB transcription factor activity,0.9832308976401852,10,0.16666666666666666,3.23365161182785e-7,8.640687666140521e-6,"CD40, FER, NTS, PRKCI, PRKD1, STAT3, TLR2, TRAF6, WNT5A, SPHK1, CLOCK, EDA2R, NLRP3","AR, CD40LG, CHUK, IKBKB, IL6, IRAK1, IRAK2, MYD88, NTRK1, PPIA, PRKCH, PSMA6, S100A8, S100A9, TRAF1, TRAF5, IKBKG, TRADD, AIM2, PRKD2, RNF31, DHX33, CARD14, CARD11, TRIM5, CARD16, RAB7B"
GO:0005201,extracellular matrix structural constituent,1.1972282106559902,7,0.16666666666666666,3.8881289851634115e-7,1.8028426482695636e-5,"COL4A1, COL4A2, FN1, LAMA4, LAMB2, LAMC1, LAMA1","COL3A1, TNC"
GO:0006954,inflammatory response,1.0212914485165794,10,0.16666666666666666,6.251982422839782e-7,1.346592692166315e-4,"ADORA3, BMP2, CD40, CDO1, CSF1R, F2R, FCGR2B, HYAL1, NFATC4, STAT3, TNFRSF1A, WNT5A, HDAC5, TRAF3IP2, MAP3K20, IL17D, NLRP3","ADORA1, CD40LG, CHUK, XCR1, IKBKB, IL6, IRAK2, NFATC3, NFX1, PIK3CD, S100A8, S100A9, CCL3, SELE, TACR1, CXCR4, HYAL3, IKBKG, MAPKAPK2, HDAC9, HDAC4, PLA2G2D, NOX1, NOX4, F11R"
GO:0007249,canonical NF-kappaB signal transduction,1.049950137122912,10,0.16666666666666666,9.553574350926462e-7,0.001147432801027139,"EP300, TRAF6, ROCK2","AKT1, BCL3, CHUK, IKBKB, IRAK1, IRAK2, IKBKG, TRADD, MAP3K14, CARD11"
GO:0005178,integrin binding,1.1992437463641652,7,0.16666666666666666,1.1107304474590567e-6,0.004871976352165571,"CALR, COL4A3, FGF2, FN1, IBSP, ICAM1, ITGAV, ITGB1, KDR, LAMA5, MYH9, P4HB, SFRP2, ADAM17, THBS4, THY1, VWF, S1PR2, JAM2, JAM3, NPNT","CD40LG, COL3A1, TNC, ICAM3, IGF1, ITGB2, PPIA, PTPN2, CXCL12, SRC, SYK, PLPP3, CD226, F11R"
GO:0048010,vascular endothelial growth factor receptor signaling pathway,1.6153079032660185,8,0.18333333333333335,1.129336028941492e-6,0.008433213904477545,"AXL, FLT1, FLT4, KDR, PRKD1, VEGFA, VEGFC, NRP1, BCAR1","PTK2B, FYN, HSPB1, SRC, MAPKAPK2, PRKD2"
GO:0035631,CD40 receptor complex,1.4390924956369984,10,0.16666666666666666,1.2479779961247868e-6,1.585921014642511e-4,"CD40, TRAF6","CHUK, IKBKB, TRAF3, TRAF5, RNF31"
GO:0006661,phosphatidylinositol biosynthetic process,1.1307155322862128,9,0.16666666666666666,1.8943672698942762e-6,0.008948416667762013,"PIK3C2A, MTMR2, INPP5J, SLC27A1","CDS1, IMPA1, INPP4A, OCRL, PI4KA, PI4KB, PTEN, MTMR1, INPP4B, MTMR7, MTMR4, FIG4, INPP5K, INPP5E"
GO:0005925,focal adhesion,1.2766143106457242,7,0.16666666666666666,9.825765605735513e-6,0.003164753159919366,"DAG1, EPHA2, ILK, ITGA1, ITGA2, ITGAV, ITGB1, MYH9, MAPK3, PXN, RDX, ADAM17, NRP1, BCAR1, PARVB, ASAP3, PARVA","ADGRB1, CFL1, PTK2B, HCK, IL16, JAK2, MSN, MAP2K1, PTPRC, RALA, SRC, VASP, LIMD1, SORBS1, ITGA11, EVL, ENAH, TRPV4"
GO:0043235,receptor complex,1.317338484216947,10,0.16666666666666666,1.306755923808008e-5,7.915586934171056e-4,"ACVR1B, ACVR2B, ADCYAP1R1, APP, BMPR1B, CD36, ERBB2, ERBB3, ERBB4, FGFR1, FLT1, FLT4, IGF1R, INSR, ITGA3, ITGB1, ITGB5, KLRC2, LDLR, LEPR, LRP1, LRP2, LRP5, NBR1, SMAD3, NR3C2, NOTCH2, NOTCH3, NPR1, NTRK3, PTH1R, PTPRB, TGFBR1, TGFBR2, TLR2, TNFRSF1A, TRPC1, VLDLR, NRP1, RAMP2, RAMP1, NLGN1, PLA2R1, SLITRK5","ADRB2, CD8A, GPR37, INSRR, ITGB2, ITGB7, NTRK1, NTRK2, TNFRSF11B, RET, VDR, TRADD, TAOK2, NR1H3, LY96, AMN"
GO:0016477,cell migration,1.3020360674810936,7,0.2857142857142857,1.4927891727531334e-5,0.004871976352165571,"CD47, CD63, EPHA2, EPHB3, ERBB4, FGFR1, FLT1, ARHGAP35, IL12A, ITGAV, ITGB1, ITGB5, JUP, LAMA5, LAMC1, NFATC2, PDPK1, PXN, RAC1, TGFB2, BCAR1, ABI2, ASAP3","APC, CD44, EFNA1, ENPEP, IL12B, PIK3CB, PLCG1, PTEN, LIMD1, ARPC5, ARC, SCRIB, NOX1, SH3KBP1, PAK5"
GO:0043491,phosphatidylinositol 3-kinase/protein kinase B signal transduction,1.6048865619546249,8,0.16666666666666666,2.1062144050129842e-5,0.034337217830853466,"EPHA2, ERBB2, ERBB3, LRP2, NF1, NKX3-1, PIK3CA, STAT3, TSC2","AKT1, ZFP36L1, EDN1, HTR2A, HTR2B, PIK3CB, PIK3CD, PIK3R1, PIK3R2, PTEN, PIK3R3, PIK3R5, THEM4"
GO:0051897,positive regulation of phosphatidylinositol 3-kinase/protein kinase B signal transduction,1.194718298264678,10,0.24285714285714285,3.961899722635636e-5,0.008046235500756492,"CALCR, CSF1R, CX3CR1, DCN, AKR1C2, ERBB3, EXTL3, F2R, F2RL1, FGF2, FGFR1, FLT1, FN1, GAS6, IGF1R, INSR, ITGB1, KDR, NEDD4, NKX3-1, NTS, PDGFA, PDGFB, PDGFRA, PDPK1, PIK3CA, PRKD1, SOX9, TCF7L2, TGFB2, TGFBR1, GDF15, SEMA3E, TREM2","CD19, HBEGF, PTK2B, FLT3, MTOR, GPER1, GRM2, HCLS1, IGF1, JAK2, MST1R, NTRK2, PTPN6, RET, CCL3, CCL19, SRC, AKR1C3, SEMA4D, PIK3R5, AMBRA1, RTN4"
GO:0031589,cell-substrate adhesion,1.809144851657941,5,0.16666666666666666,4.361550702360952e-5,0.005193797276026221,"ATP1B2, EPHB1, ITGA6, ITGA2, ITGAV, ITGB1, SMAD6, VWF",
GO:0004674,protein serine/threonine kinase activity,1.2060965677719604,10,0.16666666666666666,4.954567738218247e-5,0.045810333242440285,"ACVR1, ACVR1B, ACVR2B, ACVRL1, ATR, BMPR1A, BMPR1B, CSNK2A2, ILK, LIMK2, PDPK1, PRKAA2, PRKACA, PRKCD, PRKCE, PRKCI, PKN2, PRKD1, MAPK3, RPS6KB1, STK3, TGFBR1, MAP4K3, PPM1D, PKMYT1, LATS1, ROCK2, ULK2, SLK, HIPK3, PLK2, CHEK2, SIK2, LATS2, MAP3K20, TAOK1, PINK1, WNK4, EIF2AK4","AKT1, ARAF, CDK5, CDK7, CDK9, MTOR, GRK5, MKNK2, GSK3A, GSK3B, IKBKB, IRAK1, LIMK1, MAP3K9, MAP3K10, MAP3K11, PAK3, PRKCB, MAPK4, MAPK6, MAPK11, MAPK9, MAP2K1, MAP2K6, MAP4K2, RPS6KA1, RPS6KA3, RPS6KB2, MAPK12, SGK1, SRPK1, AURKA, SYK, MKNK1, MAP3K14, MAPKAPK2, TAOK2, IKBKE, AKT3, PIM2, MAP4K1, PRKD2, STK39, IRAK4, TAOK3, CSNK1G1, WNK3, SIK1, KSR2"
GO:0007160,cell-matrix adhesion,0.9691847419596111,7,0.16666666666666666,5.236188103996595e-5,0.002068145632588439,"CD63, ITGA1, ITGA2, ITGAV, ITGB1, ITGB5, ITGB8, TSC1, SGCE, NPNT","COL3A1, ITGB2, ITGB7, SORBS1, ITGA11"
GO:0035987,endodermal cell differentiation,1.292246322612815,1,0.16666666666666666,1.1250251555416105e-4,1.1250251555416105e-4,"COL4A2, FN1, ITGAV, ITGB5, MMP14, MMP15, NODAL, HMGA2","INHBA, ITGB2, LAMA3, LAMB3"
GO:0086064,cell communication by electrical coupling involved in cardiac conduction,1.4133944153577662,10,0.16666666666666666,1.1275645733309715e-4,0.01233362862958482,"ATP1A2, ATP1B2, CACNA1C, PRKACA, SLC8A1",
GO:0043123,positive regulation of canonical NF-kappaB signal transduction,1.1061347598452083,7,0.16666666666666666,1.3915081437416602e-4,0.016392612302265967,"CD36, CD40, CX3CR1, LPAR1, F2R, F2RL1, FLOT2, ILK, LTBR, PRKN, PRKD1, TNFRSF1A, TRAF6, FLOT1, TRAF3IP2, PINK1, TIFA, DAB2IP, TAB3","PARP1, FASLG, CHUK, GAPDH, HTR2B, IKBKB, IRAK1, MYD88, PRKCB, PRL, CCL19, TRAF5, CUL1, IKBKG, TRADD, TNFSF10, IKBKE, RBX1, PIM2, IRAK4, RNF31, SHARPIN, CARD11, TRIM5, CARD16, TICAM1"
GO:0007155,cell adhesion,1.2134508151364236,7,0.16666666666666666,1.6541390500274502e-4,0.029701053666407604,"ARHGAP5, ATP2A2, CTNNB1, CX3CR1, CYP1B1, DSG2, EFNB2, GP1BA, IBSP, ICAM1, ITGA2, ITGA9, ITGAV, ITGB1, ITGB8, LAMC1, AFDN, RAC1, ROBO1, ADAM17, VWF, SSPN, MAGI1, CHST10, FARP2, CDON, RGMB","ALCAM, ARF6, RHOB, ADGRB1, CD44, CD72, CTNND2, DSC2, EFNB1, HCK, ITGB2, ITGB7, CCL11, CXCL12, SELL, SEMA4D, ITGA11"
GO:0003700,DNA-binding transcription factor activity,1.1719825225156368,10,0.16666666666666666,1.7134404068641057e-4,0.00421203178905448,"AHR, DDIT3, MECOM, FOXO3, FOXA3, HNF4G, RBPJ, SMAD1, SMAD3, SMAD4, SMAD9, MEF2A, NR3C2, NFATC1, NFATC2, NFYB, NKX3-1, PPARD, RARA, REST, SOX9, SP1, STAT2, STAT3, STAT4, STAT5A, STAT6, TCF7L2, TEAD1, TEAD4, TEAD3, TGIF1, THRA, TP73, TEAD2, CLOCK, HEY1, HEYL","AR, ARNT, RUNX3, E2F3, E2F4, ELK1, ESRRB, ETS1, FOSL2, GLI2, HIF1A, IRF3, IRF4, JUN, NFIL3, NFYC, POU2F2, POU5F1, RORB, SREBF1, TP53, VDR, XBP1, ZBTB17, FOSL1, ARNT2, NR1I3, KLF2, IRF9, HES6, BATF3, ZNF746, MAFA"
GO:0043410,positive regulation of MAPK cascade,1.0671921877757515,1,0.14285714285714285,2.1817280327788319e-4,2.1817280327788319e-4,"ADRA2C, BMP2, LPAR1, F2R, FGF2, FGFR1, FLT1, FLT4, GRM4, HRAS, IL11, INSR, KDR, PDGFA, PDGFB, RYK, TGFA, VEGFA, WNT5A, FZD7, KSR1, ROCK2, GDF15, GHRL, DAB2IP","ADRB2, GSDME, FGF10, FLT3, GPER1, GPR37, IGF1, IL6, NTRK2, PPIA, PTPRC, RET, TAOK2, MAP4K1, WNT4, DHX33, TRIM5"
GO:0005788,endoplasmic reticulum lumen,1.2731019326481805,7,0.16666666666666666,2.2772981760297e-4,0.001245512806590182,"APP, ARSB, BMP4, SERPING1, C3, C4A, CALR, CES1, COL2A1, COL4A1, COL4A2, COL4A3, COL6A2, COL9A2, COL9A3, CSF1, DAG1, FN1, GAS6, GIP, GPC3, PDIA3, HRC, IL12A, LAMB2, LAMC1, LTBP1, MFGE8, P4HB, PDGFA, PDGFB, SERPINA1, MAPK3, DNAJC3, SDC2, ADAM17, HSP90B1, WNT3, WNT5A, WNT6, PDIA6, GANAB, BACE1, GHRL, CYP2W1, PDGFC, WNT5B, NOTUM, P4HA3, GPX8","AFP, APOA2, APOE, ARSA, BDNF, BGLAP, COL3A1, DBI, F10, TNC, IL6, IL12B, LIPC, MEN1, CFP, PLAUR, PROC, TF, TIMP1, WFS1, WNT7B, P4HA2, ERO1A, IL23A, WNT4, ACE2"
GO:0001228,"DNA-binding transcription activator activity, RNA polymerase II-specific",0.8891096493190733,10,0.16666666666666666,3.0730018633137816e-4,0.020420865254916244,"DDIT3, FOXO3, HNF4G, RBPJ, SMAD1, SMAD3, SMAD4, MEF2A, NFATC1, NFYB, NOTCH2, NOTCH4, NRF1, RXRB, SOX9, SP1, STAT3, STAT6, TP73, ZNF76, CLOCK, ZNF300","AR, CEBPE, E2F3, E2F4, ELK1, ELK4, ESRRB, ETS1, FOSL2, HIF1A, HSF1, IRF3, IRF4, JUN, NFATC3, PGR, RFX5, SREBF1, TBX3, TP53, ZBTB17, NR1I3, CREB3, MEF2B"
GO:0061629,RNA polymerase II-specific DNA-binding transcription factor binding,1.2269466414169545,10,0.16666666666666666,3.74574119392528e-4,0.03217753855125597,"AHR, CD34, CREBBP, CRKL, CTNNB1, DDIT3, EP300, EPAS1, ETS2, HES1, ID2, RBPJ, SMAD3, MEF2A, NFATC1, REST, SP1, STAT3, TCF7L2, TEAD3, TP73, HMGA2, HDAC5, SPEN, ZFPM2, HEY1, MLXIPL, STING1","PARP1, AR, ARNT, DAXX, ELK1, ESRRB, ETS1, GSK3B, HCLS1, HIF1A, HSPB1, JUN, MEF2D, RBBP8, TBX3, TP53, HDAC9, HDAC4, KEAP1, RBX1, PPARGC1A, HES6, SDR16C5"
GO:0071276,cellular response to cadmium ion,1.130715532286213,10,0.16666666666666666,4.2795892694512047e-4,0.027061087539456064,MAPK3,"AKT1, CHUK, DAXX, HSF1, JUN, MAPK9"
GO:0007259,cell surface receptor signaling pathway via JAK-STAT,1.2335078534031414,10,0.16666666666666666,4.802521747990855e-4,0.014096616716271484,"CSF2RA, JAK1, STAT2, STAT3, TYK2, SOCS6, CLCF1","CSF2RB, IFNG, JAK2, PIAS1, IL31RA"
GO:0006468,protein phosphorylation,1.1671902268760908,8,0.16666666666666666,4.890880411817284e-4,0.04501323843926011,"APP, ERBB2, FER, GAS6, ILK, INSR, JAK1, LIMK2, MYLK, PDGFB, PDPK1, PRKAA2, PRKAB1, PRKACA, PRKCD, PRKCE, PRKCI, PKN2, PRKG1, MAPK3, RARA, RYK, STK3, TYK2, WNT11, MAP4K3, CAMK1, LATS1, ROCK2, HIPK3, MERTK, PLK2, CHEK2, SIK2, SGK3, PRKD3, LATS2, MAP3K20, PINK1, WNK4, ADM2, MYLK3, EIF2AK4","AKT1, CAMK2B, RUNX3, CDK5, CDK9, CHUK, CSK, CTSG, PTK2B, MTOR, MKNK2, GSK3A, GSK3B, HCK, IKBKB, IRAK2, JAK2, JAK3, LIMK1, MAP3K9, MAP3K11, NTRK1, PPP3CB, PRKAG1, PRKCB, PRKCH, PRKG2, MAPK4, MAPK6, MAPK9, MAP2K1, MAP4K2, RET, RPS6KA1, CCL11, SGK1, SRPK1, AURKA, SYK, TXK, YWHAZ, MKNK1, MAP3K6, MAPKAPK2, AKT3, PIM2, MAP4K1, PRKD2, STK39, PKN3, TAOK3, WNK3, SIK1"
GO:0043536,positive regulation of blood vessel endothelial cell migration,1.262194082552052,10,0.5,5.231208219857749e-4,0.0015306265792490114,"CD40, FGF2, FGFR1, GAB1, KDR, PDGFB, PDPK1, PRKD1, SP1, STAT5A, ADAM17, VEGFA, FGF18, NUS1","AKT1, ATP5F1B, ETS1, HIF1A, HSPB1, PLCG1, TMSB4X, AKT3, PRKD2, ANGPT4"
GO:0008083,growth factor activity,1.3460899193883487,10,0.16666666666666666,5.443560156999961e-4,0.014158399433513961,"BMP2, CSF1, FGF2, GDNF, CXCL1, IL7, IL11, IL12A, NRTN, NTF3, PDGFA, PDGFB, PSPN, TGFA, VEGFA, ARTN, CLCF1, FGF20","CNTF, HBEGF, FGF10, IL6, IL12B, INHA, INHBA"
GO:0001934,positive regulation of protein phosphorylation,1.1533298429319372,9,0.16666666666666666,5.976202732013105e-4,0.04607290872272759,"ABL1, APP, CCND1, BMP2, BMP4, C3, CCND2, CD40, CRKL, CSF1R, DVL3, ERBB2, ERBB4, FLT4, GAS6, HRAS, ILK, INSR, KDR, LEPR, LIMK2, NKX3-1, NTRK3, P2RY1, PIN1, RAC1, SOX9, VEGFA, AXIN2, ROCK2, FLOT1, ERP29, TREM2","AKT1, CCND3, CDKN1A, DAXX, DVL2, EFNA1, GPER1, HSP90AA1, NTRK1, NTRK2, PLAUR, PPIA, PIK3R3, HDAC3, SEMA4D, CARD14, IL34, CLDN19"
GO:0031295,T cell costimulation,1.2664013961605587,9,0.16666666666666666,6.546246864756412e-4,0.021237478257862447,"PDPK1, PIK3CA, YES1","AKT1, CD28, CD40LG, CSK, MTOR, FYN, PTPN6, CCL19, SRC, CD274, CARD11"
GO:0004896,cytokine receptor activity,1.4537771129394168,10,0.16666666666666666,6.551532163754932e-4,0.02049168029672031,"IL15RA, FZD4","CD44, FLT3, IL7R, IL12RB1, IL13RA2, IL21R, IL31RA"
GO:0034614,cellular response to reactive oxygen species,1.049950137122912,10,0.16666666666666666,6.734993320741896e-4,0.023578904534633335,"FER, MMP3, PDGFRA, PDK2, PEX14, MAPK3, PXN","AKT1, CHUK, GPR37, JUN, MAPT, MAPK9"
GO:0004115,"3',5'-cyclic-AMP phosphodiesterase activity",1.4390924956369984,8,0.16666666666666666,7.301710143310053e-4,0.046280220472763915,"PDE1C, PDE3A, PDE4A","PDE3B, PDE4B, PDE4D, PDE7A"
GO:0042531,positive regulation of tyrosine phosphorylation of STAT protein,0.9548264494861354,8,0.16666666666666666,8.931801151220541e-4,0.023248451936579942,"CD40, CSF1R, ERBB4, HES1, IL12A, TNFRSF1A, CLCF1","CNTF, FLT3, HCLS1, IFNG, IGF1, IL4, IL6, IL6R, IL12B, JAK2, IL23A, IL31RA"
GO:0010506,regulation of autophagy,1.1972282106559902,1,0.14285714285714285,0.0012795794611695477,0.0012795794611695477,"ABL1, DDIT3, EP300, ITPR1, PRKN, PIK3C3, PIP4K2B, MAPK15","ABL2, IFI16, MAPT, RAB8A, PIK3R2, PIP4K2A, KEAP1, HDAC6, WDR41, RAB39B"
GO:0019838,growth factor binding,1.5963042808746537,8,0.16666666666666666,0.0013961606763226095,0.043456663268992356,"A2M, ACVR1B, ACVR2B, EPHA2, ERBB2, ERBB3, FLT1, FLT4, KDR, TGFBR1, NRP1, OSMR",
GO:0038061,non-canonical NF-kappaB signal transduction,0.9893760907504363,3,0.16666666666666666,0.0014368541084510507,0.04842862040212816,"CREBBP, TRAF6, TAB1, TAB3","AKT1, CHUK, MAP3K14"
GO:0010881,regulation of cardiac muscle contraction by regulation of the release of sequestered calcium ion,1.5076207097149505,2,0.17142857142857143,0.001518190827299166,0.0016765400488557506,"ANK2, ATP1A2, CACNA1C, DMD, HRC, PRKACA, RYR2, SLC8A1",
GO:0006883,intracellular sodium ion homeostasis,1.5076207097149505,2,0.17142857142857143,0.001518190827299166,0.0016765400488557506,"ATP1A2, ATP1B2, SCNN1A, SCNN1B, SCNN1G, SLC8A1, SLC12A2",ATP1B3
GO:0032869,cellular response to insulin stimulus,1.474846346460278,10,0.16666666666666666,0.0015543024039838165,0.028722799645981574,"INHBB, INSR, MYO5A, ENPP1, PDPK1, PIK3CA, PRKCI, SLC2A4, IRS2, TBC1D4, RHOQ, CPEB1","PARP1, AKT1, BGLAP, ZFP36L1, MTOR, GOT1, GPLD1, GSK3A, RAB8A, PDE3B, PIK3R1, PIK3R2, RAB13, XBP1, HDAC9, SORBS1, RAB10, INPP5K"
GO:0038083,peptidyl-tyrosine autophosphorylation,1.5076207097149505,7,0.16666666666666666,0.001991716548780431,0.003140310466255688,"ABL1, IGF1R, KDR, MAPK3","PTK2B, NTRK1"
GO:0042056,chemoattractant activity,1.2563505914291253,1,0.16666666666666666,0.002770822803461485,0.002770822803461485,"BMP4, FGF2, NTF3, PDGFB, VEGFA, VEGFC","FGF10, VEGFD, CCL3, CCL15"
GO:0031996,thioesterase binding,1.5076207097149505,9,0.16666666666666666,0.002951823636451819,0.004465928538376582,"RAC1, TRAF4","ARF6, TRAF1, TRAF3, TRAF5"
GO:0034142,toll-like receptor 4 signaling pathway,1.1902268760907504,4,0.16666666666666666,0.0030014318251293747,0.003999491844528696,"CD14, TRAF6","CHUK, IRAK2, IRF3, MYD88, OAS1, TRAF3, LY96, TICAM1"
GO:0033627,cell adhesion mediated by integrin,1.130715532286213,5,0.16666666666666666,0.0032969879630464394,0.005193797276026221,"ITGA2, ITGAV, ITGB1, ADAM17",ITGA11
GO:0016303,1-phosphatidylinositol-3-kinase activity,1.3568586387434558,1,0.14285714285714285,0.0032969879630464394,0.0032969879630464394,"PIK3C2A, PIK3C3, PIK3CA","PIK3CB, PIK3CD, PIK3R3"
GO:0034236,protein kinase A catalytic subunit binding,1.7395623573634045,1,0.16666666666666666,0.0034160648118022247,0.0034160648118022247,"KCNQ1, PRKAR1A, PRKAR1B, PRKAR2A, RYR2, SMO, SOX9","CSK, GSK3A, GSK3B"
GO:0035666,TRIF-dependent toll-like receptor signaling pathway,1.5076207097149505,4,0.16666666666666666,0.003544015105150847,0.004465928538376582,TRAF6,"IKBKB, IRF3, TRAF3, CD274, TICAM1"
GO:0046982,protein heterodimerization activity,1.0888371792385756,10,0.18333333333333335,0.004067409735661247,0.03493871446374487,"ADRA2C, AGTR1, AHR, ATP1A2, ATP1B2, BCL2, BMP6, DDIT3, EPAS1, ERBB2, ERBB3, EXT1, EXT2, HEXA, IL12A, ITGA3, ITGB1, MEF2A, P4HB, PAFAH1B2, PDGFA, PDGFB, TPM2, FZD4, VAPA, MLXIPL, ALG2, SLC51A, TUBB2B","APOA2, ARNT, BAK1, BDKRB2, CHUK, GADD45A, HIF1A, HSF1, IKBKB, IL12B, IRAK1, IRAK2, KRT10, PIK3R2, PPP2CA, AURKA, TP53, XBP1, IKBKG, NAE1, ARNT2, RALGAPA2, RRAGD"
GO:0005518,collagen binding,1.33630017452007,1,0.16666666666666666,0.0041726491480101584,0.0041726491480101584,"COL6A2, CTSB, ITGA1, ITGA2, MMP13, PDGFA, PDGFB, VWF, MRC2","CTSK, CTSS, LUM, ITGA11"
GO:0006470,protein dephosphorylation,1.32736171181425,1,0.16666666666666666,0.004484250983563159,0.004484250983563159,"PPP2CB, PPP2R3A, PPP3CA, PTPN13, PTPRB, PTPRM, PTPRR, PPM1D, SSH1","DUSP2, DUSP5, DUSP9, PPM1B, PPP1CB, PPP2CA, PPP2R2A, PPP3CB, PPP3CC, PTEN, PTPN1, PTPN6, PTPRC, PTPRD, MTMR7, MTMR4, PDXP, SSH2"
GO:0004725,protein tyrosine phosphatase activity,0.9799534613147178,1,0.16666666666666666,0.00483939405188778,0.00483939405188778,"PTPN13, PTPRM","DUSP1, DUSP2, DUSP4, DUSP5, PPP2CA, PTEN, PTPN1, PTPN2, PTPN6, PTPRC, MTMR7"
GO:0046326,positive regulation of glucose import,1.2437870855148343,6,0.16666666666666666,0.0052867430119154435,0.006483610114883634,"INSR, PRKCI, IRS2, RHOQ, APPL1, OCLN","AKT1, IGF1, PIK3R1, CLTCL1, SORBS1"
GO:0005125,cytokine activity,0.9918557300756252,2,0.18333333333333335,0.006332887229435743,0.006332887229435743,"BMP2, BMP4, CSF1, FGF2, IL7, IL11, IL12A, INHBB, VEGFA, WNT2, GDF15, CLCF1, IL17D","CD70, EDN1, IFNG, IL4, IL6, IL12B, IL15, INHA, INHBA, TNFRSF11B, TIMP1, IL19"
GO:0060337,type I interferon-mediated signaling pathway,1.2176936501543831,10,0.16666666666666666,0.006828334754237524,0.013407206339454292,"JAK1, STAT2, TYK2","IRAK1, MYD88, OAS2, HDAC4"
GO:0030335,positive regulation of cell migration,1.130715532286213,5,0.16666666666666666,0.008257265266945438,0.021478258134156797,"ACVR1, BMP2, CDH5, CSF1, EPHA2, EPHA4, F2R, F2RL1, F3, FER, FLT1, HRAS, IGF1R, INSR, ITGA6, ITGB1, KDR, MMP14, MYLK, NTF3, NTRK3, ROR2, PDGFA, PDGFB, PDGFRA, PPP3CA, RDX, SMO, STAT3, ADAM17, TGFBR1, TWIST1, VEGFA, FZD4, SPHK1, CLDN1, ROCK2, BCAR1, ZNF268, DAAM2, CXCL16, WNT5B","APC, DRD1, HBEGF, EDN1, EPHA1, EPHB2, F10, PTK2B, GPER1, IGF1, IL4, LAMC2, MGAT5, PIK3CD, PLAU, RET, CCL3, CCL11, CCL24, SOD2, STX4, XBP1, CXCR4, TRADD, SEMA4D, TWIST2"
GO:0035970,peptidyl-threonine dephosphorylation,1.7588908280007756,1,0.16666666666666666,0.008313522498518048,0.008313522498518048,"PPP2CB, PPM1D","DUSP1, DUSP5, PPM1B, PPP2CA, DUSP10"
GO:1990573,potassium ion import across plasma membrane,1.130715532286213,1,0.16666666666666666,0.008374919522679802,0.008374919522679802,"ATP1A2, ATP1B2, KCNJ8, SLC12A2","ATP1B3, KCNJ11, ABCC8, KCNK9"
GO:0007173,epidermal growth factor receptor signaling pathway,1.319168121000582,6,0.16666666666666666,0.009075812343237927,0.01952950897011849,"GAB1, PDPK1, PIK3C2A, PIK3CA, SOX9, TGFA, NCK2, BCAR1, PLCE1","AKT1, HBEGF, PLCG1, SRC, SHC3"
GO:0071222,cellular response to lipopolysaccharide,0.8614975484085432,4,0.16666666666666666,0.009381686814463743,0.013828760313394365,"AXL, CD14, CX3CR1, MMP3, UPF1, CXCL6, TRAF6, WNT5A, SHPK, NLRP3, DAB2IP","CASP7, CTSG, IL6, IL10, MYD88, PDE4B, TNFAIP3, TNFSF4, XBP1, NR1H3, PDCD4, CARD16, TICAM1"
GO:0030593,neutrophil chemotaxis,1.6714925259883149,1,0.16666666666666666,0.010428152979307905,0.010428152979307905,"BSG, EDN3, CXCL6, XCL1, TGFB2","EDN1, EDN2, CXCL3, NCKAP1L, ITGB2, PDE4B, PIK3CD, PPIA, S100A8, S100A9, CCL3, SYK"
GO:1902895,positive regulation of miRNA transcription,1.222395170039149,6,0.16666666666666666,0.011414640478231814,0.02021530157598377,"FOXO3, SMAD3, NGFR, NOTCH2, NOTCH3, PDGFB, STAT3, TEAD1, TGFB2","AR, ETS1, HIF1A, IL10, JUN, PRL, SMARCA4, SREBF1, TERT, TP53, FOSL1"
GO:0019903,protein phosphatase binding,1.1537913594757274,7,0.16666666666666666,0.011971494857333826,0.02319414547494059,"CDH5, CDKN1B, FLT4, ITGA1, JAK1, JUP, MET, PXN, STAT3, STAT6, HSP90B1","ANK1, JAK3, KCNN4, MET, PIK3R1, PIK3R2, PPP1R3C, TRAF3, VCP, SKAP1, MTMR4, IKBKE, ANAPC7, AMBRA1, PPP1R3F"
GO:0045672,positive regulation of osteoclast differentiation,1.319168121000582,2,0.16666666666666666,0.013595642645032519,0.01617250798060826,"CSF1, PPP3CA, TRAF6","IFNG, IL12B, IL23A, RPTOR"
GO:0034446,substrate adhesion-dependent cell spreading,1.3916498858907236,1,0.16666666666666666,0.013826611355373448,0.013826611355373448,"EPHB3, FER, FN1, ILK, ITGAV, LAMA5, LAMC1, RAC1, BVES, RADIL, PARVA","EFNA1, EPHA1, ITGB7, PIK3R1, SRGAP2"
GO:1903078,positive regulation of protein localization to plasma membrane,1.481627249202624,5,0.16666666666666666,0.01395694023023553,0.024379553100915486,"ATP2B4, DLG1, EPHA2, ITGA3, ITGB1, LRP1, PDPK1, PRKCE, PRKCI, TREM2","AKT1, ARF6, EPHB2, GPER1, PIK3R1, PRKCH, STX4, SORBS1, WNK3"
GO:0004712,protein serine/threonine/tyrosine kinase activity,1.6446771378708553,3,0.2,0.014292714176144094,0.02134589238339782,"PRKAA2, PRKACA, RPS6KB1","AKT1, MAP2K1, RPS6KA1, SGK1, AURKA"
GO:0046854,phosphatidylinositol phosphate biosynthetic process,1.292246322612815,1,0.14285714285714285,0.015293300416970647,0.015293300416970647,"ITPKA, PIK3C3, PIK3CA, IP6K1","ITPKB, PIK3CB, PIK3R1, PI4KA"
GO:0032760,positive regulation of tumor necrosis factor production,0.9045724258289705,1,0.16666666666666666,0.01555653167727369,0.01555653167727369,"APP, CD14, STAT3, TLR2, TWIST1, WNT5A","TNFRSF8, EPHB2, HSPB1, IFNG, IL6, IL12B, JAK2, LPL, OAS1, OAS2, PTPRC, CCL3, CCL19, SYK, RIGI, LY96, IL23A, SPHK2, IFIH1, HAVCR2"
GO:0001938,positive regulation of endothelial cell proliferation,1.5319371727748692,10,0.24285714285714285,0.01969300744840874,0.04919149056813156,"F3, FGF2, FLT4, KDR, PDGFB, PRKD1, STAT5A, TGFBR1, THBS4, VEGFA, WNT5A, TNFSF12, NRP1","AKT1, HTR2B, PIK3CD, PLXNB3, CCL11, CCL24, AKT3, PRKD2"
GO:0030552,cAMP binding,1.3568586387434558,4,0.16666666666666666,0.023408751478708682,0.028663554823810593,"CNGA1, PDE4A, RAPGEF2","PDE4B, PDE4D, PDE10A"
GO:0043406,positive regulation of MAP kinase activity,1.182111692844677,2,0.16666666666666666,0.02580178101005257,0.030075188851864856,"CD40, DRD4, EDN3, ERBB2, FGF2, FGFR1, FLT1, HRAS, INSR, NTF3, NTRK3, PDGFA, PDGFB, ROBO1, FGF18, ERP29","EDN1, EZH2, FLT3, HTR2B, MST1R, PIK3R5, IL34"
GO:0001916,positive regulation of T cell mediated cytotoxicity,1.130715532286213,5,0.16666666666666666,0.027061087539456064,0.03401604165743277,"IL12A, XCL1, STX7","HLA-F, IL12B, IL12RB1, IL23A"
GO:0032757,positive regulation of interleukin-8 production,0.7253646810892687,6,0.16666666666666666,0.028104205782117184,0.047761911360268326,"CD14, DDIT3, F2R, F2RL1, F3, STAT3, TLR2, HYAL2, IL17D","APOA2, IL6, MYD88, SYK, TLR5, RIGI, PRKD2, CD244"
