ID,Term_Description,Fold_Enrichment,occurrence,support,lowest_p,highest_p,Up_regulated,Down_regulated
GO:0031625,ubiquitin protein ligase binding,1.4449914866063933,8,0.1213235294117647,0.007718638930530829,0.04162816069047612,"ACTG1, APBB1, ARRB2, CASP10, DAXX, MC4R, PRKACB, RPA2, SUMO2, ELOB, TNFRSF1B, TP53, TRAF2, UBE2L3, SUMO1, UQCRC1, YWHAE, CXCR4, TNFRSF14, EIF4E2, PRDX6, IKBKE, RBX1, GLMN, GABARAP, UBE2T, UBXN1, TRIB3, MAP1LC3A, TUBB","ACVR1B, APC, BCL2, CALR, CBS, CDKN1A, CTNNB1, DBT, EGFR, EGR2, ERBB3, FOXO1, GPR37, GSK3B, HIF1A, HSPA1L, HSPA5, HSPA9, HSP90AA1, HSP90AB1, HSPD1, JUN, LTBR, SMAD1, SMAD2, SMAD3, SMAD5, SMAD7, NFE2L2, NGFR, PRKN, PRKAR1A, PRKAR2A, RALA, SCN5A, SKI, TMBIM6, TRAF3, VCL, WFS1, FZD5, CUL5, FZD6, FZD8, CUL4A, CUL3, CUL2, CUL1, IKBKG, BECN1, SQSTM1, BAG4, TRAF4, SNCAIP, MFN2, TANK, GABARAPL1, ARIH1, SNX9, FANCL, AMBRA1, RTN4, PINK1"
GO:0052629,"phosphatidylinositol-3,5-bisphosphate 3-phosphatase activity",1.0006177606177606,6,0.06458333333333333,0.008242510497329165,0.010187719043993838,MTMR14,"MTM1, MTMR1, SYNJ1"
GO:0070372,regulation of ERK1 and ERK2 cascade,1.1771973654326595,4,0.0625,0.009113502083609441,0.012910634213445337,"GSTP1, PTPN6, RRAS, RASGRP1","EGFR, EPHA2, ERBB2, FGFR2"
GO:0070412,R-SMAD binding,1.429453943739658,2,0.059027777777777776,0.009176372716422142,0.009176372716422142,"MEN1, RGCC","FOS, JUN, SMAD2, SMAD3, PPM1A, SMURF1"
GO:0000307,cyclin-dependent protein kinase holoenzyme complex,1.591891891891892,2,0.05718954248366013,0.00968967005479315,0.012157146366688411,"CCND3, CDK1, CDK5","CCND1, CDK4, CDKN1A, CDK5R1"
GO:0004623,phospholipase A2 activity,1.334157014157014,2,0.06696428571428571,0.009733248176301565,0.016082082344741542,"PLA2G2A, PLA2G6, PRDX6, PLAAT2, PNPLA2","PLA2G4A, PNPLA3, PLA2G4B"
GO:0045766,positive regulation of angiogenesis,0.9488616695513247,10,0.1213235294117647,0.010310938232462546,0.021947473252724087,"AQP1, HSPB1, PIK3CD, RLN2, RRAS, RAMP2, PRKD2, PIK3R6","RHOB, CDH5, CHRNA7, CYP1B1, EPHA1, FGF2, FLT1, GAB1, HIF1A, HK2, ITGB1, ITGB8, JUP, KDR, NOS3, PDPK1, PRKD1, SP1, TEK, HMGA2, PAK4, SIRT1, HIPK2, ZNF304, WNK1"
GO:0090314,positive regulation of protein targeting to membrane,1.9456456456456457,9,0.0625,0.010487354620489773,0.01882528271667367,"FYN, HRAS, FIS1","AKT2, ANK3, ERBB2, PRNP"
GO:0050679,positive regulation of epithelial cell proliferation,1.429453943739658,10,0.125,0.010677269831161398,0.016137037141328178,"BAD, HRAS, IGF1, NME1, SOX9","BMP6, EGFR, ERBB2, FGFR2, LAMC1, MYC, SCN5A, SFRP1, TGFA, YAP1, ZNF304"
GO:0007264,small GTPase-mediated signal transduction,1.591891891891892,7,0.0625,0.010871526673145854,0.015863129309368316,"PLD1, RAC1, ARHGEF18","PLD2, RAPGEF2, RALBP1, HACD3"
GO:0034446,substrate adhesion-dependent cell spreading,1.346985446985447,8,0.0625,0.010963501265553286,0.024386711901463756,"RHOA, RAC1, FERMT3","EFNA1, EPHA1, FER, ITGAV, ITGB3, LAMA5, LAMC1, PIK3R1, TEK, BVES, PARVA"
GO:0003924,GTPase activity,1.1754244778341165,1,0.0625,0.01107196866376956,0.01107196866376956,"RHOA, RHOG, ARHGDIB, GNA15, GNAQ, GNB2, GNGT2, HRAS, RAB13, RAC1, RRAS, RAB11B, RGS14, AGAP2","ARF6, RHOB, ARHGAP5, DDX3X, EEF2, GNA11, GNAI1, GNGT1, GSPT1, RAB8A, MMUT, OPA1, SEPTIN5, RAB1A, RAB2A, RAB3A, RALA, RASA1, RAB9A, RRAGB, RHOQ, SAR1B, RAB14, MFN1, RAB33B"
GO:0046339,diacylglycerol metabolic process,1.2507722007722006,10,0.0625,0.011336518902119418,0.023577536885219588,"DGKA, DGKZ, DGKE, DGAT1, PGS1","DGKB, PGS1"
GO:0005901,caveola,1.149358238547428,4,0.0625,0.011414640478231814,0.017622421922710112,"MAPK3, FLOT1","BMPR1A, BMPR2, F2R, IRS1, LRP6, NOS3, MAPK1, PTCH1, SCN5A, SMO, SRC, TGFBR2, PLPP1, NOS1AP, BVES"
GO:0031334,positive regulation of protein-containing complex assembly,1.613899613899614,2,0.05555555555555555,0.011517874632404747,0.01265061796758097,"BAK1, BAX, BID, RPS3, SUMO1, RACK1, PARK7, BRK1, BMF","CDH5, GSK3B, MMP1, MMP3, TFRC, FNIP2, CLEC7A, AJUBA, FNIP1, TIRAP, DAB2IP"
GO:0034236,protein kinase A catalytic subunit binding,1.7318384318384317,8,0.0625,0.011634317770943762,0.013407206339454292,"CSK, GSK3A, SOX9","GSK3B, KCNQ1, PRKAR1A, PRKAR2A, RYR2, SMO"
GO:0019221,cytokine-mediated signaling pathway,1.0506486486486488,7,0.0625,0.011857163983420644,0.03141480053352127,"CTSG, IL12RB1, PTPN6, SOCS1, CRLF2","AKT1, FER, IL6R, IL6ST, IL7, IRS1, KIT, PIK3R1, PTPN11, PTPRJ, SOS1, NUMBL, SOCS5, IRAK3, DUOX2, DUOX1"
GO:0043507,positive regulation of JUN kinase activity,1.2007413127413127,6,0.06458333333333333,0.012132160976527523,0.017350603759847198,"MAP3K11, MAP2K7, MAP4K2, RPS3, TRAF2, MIR92A1","MAP3K5, PAK1, PTPN1, TNFRSF11A, MAP3K13, DAB2IP"
GO:0031466,Cul5-RING ubiquitin ligase complex,2.5015444015444017,6,0.0625,0.012712285555247754,0.014261026835353529,"ELOC, ELOB, RNF7, RBX1",CUL5
GO:0001938,positive regulation of endothelial cell proliferation,1.2104247104247103,1,0.0625,0.013013733274482561,0.013013733274482561,"PIK3CD, PRKD2","AKT1, EGR3, FGF2, FLT4, HTR2B, ITGB3, KDR, PLXNB3, PRKD1, TEK, NRP1, AKT3, SIRT1"
GO:0035023,regulation of Rho protein signal transduction,1.5009266409266409,1,0.0625,0.013471884932623862,0.013471884932623862,ARHGDIB,"ARHGDIA, RAF1"
GO:0003682,chromatin binding,1.3588636255302922,1,0.05555555555555555,0.013707809950818316,0.013707809950818316,"APBB1, CDK9, CSNK2B, EZH2, NR5A1, PCNA, PKN1, RAD51, SOX9, SPI1, SUV39H1, TP53, NELFE, HDAC3, KDM1A, UBE2T, SIRT7, SIRT6, KMT5C, CDCA5, CENPS","CREBBP, CTNNB1, EGFR, EGR2, EP300, FOXO1, MEF2A, MED1, PRKAA1, RARA, UPF1, SMARCE1, TFAM, TPR, SETDB1, PARP2, CITED2, KAT5, ZNF274, CHD8, FANCM, NSD1, ZNF354B"
GO:2000811,negative regulation of anoikis,1.7318384318384317,10,0.0625,0.014330419514492009,0.02734311462093137,,"BCL2, ITGB1, NOTCH1, PIK3CA, PTK2, SNAI2, SRC, TLE1, ZNF304"
GO:0071364,cellular response to epidermal growth factor stimulus,1.8761583011583012,9,0.0625,0.015174002465212383,0.03114247367433693,"SOX9, INPP5K","AKT1, ZFP36L1, ZFP36L2, DUSP3, EGFR, ERBB2, PDE8A, PDPK1, MED1, PTPN11, SNAI2, IQGAP1, DAB2IP"
GO:0017147,Wnt-protein binding,1.563465250965251,6,0.0625,0.016487260517436327,0.04842862040212816,,"LRP6, LRP5, ROR2, RYK, SFRP1, FZD5, FZD3, FZD1, FZD6, APCDD1"
GO:0000082,G1/S transition of mitotic cell cycle,1.5009266409266406,8,0.09126984126984126,0.016632114445976297,0.046769729040073045,"CCND3, CDC25A, EIF4EBP1, PIM2","ACVR1B, CCND1, CDK4, CDKN1A, EIF4E, GSPT1, MYC, RPS6KB1, CUL5, CUL4A, CUL3, CUL2, CUL1, PLK2"
GO:0005741,mitochondrial outer membrane,1.3514090445124929,1,0.05555555555555555,0.017272571195439925,0.017272571195439925,"ATP5MC2, BAD, BAK1, BAX, BCL2L1, BID, BNIP1, TSPO, NME3, RAC2, RPS27A, UBA52, TOMM40, SAMM50, FIS1, TOMM7, RHOT2, BMF","BCL2, BNIP3, CPT1A, CPT1B, CYP27B1, ACSL1, ACSL3, ACSL4, FOXO3, HADHB, HK2, OPA1, PDE2A, PMAIP1, RAF1, TOMM20, TOMM70, MFN2, RAB11FIP5, MARCHF5, RHOT1, AGPAT5, MFN1, AGK, TIGAR, ZNFX1, GPAM, PINK1, USP30"
GO:0001678,intracellular glucose homeostasis,1.7510810810810813,8,0.0625,0.017295652292196446,0.030992447360035532,,"FOXO1, HIF1A, NGFR, PIK3R1, NR1D1, SIRT1, HKDC1"
GO:0071456,cellular response to hypoxia,1.2288288288288287,1,0.05555555555555555,0.017412254782260404,0.017412254782260404,"AQP1, BAD, MDM4, OPRD1, SUV39H1, TP53, VHL, RGCC","BNIP3, ZFP36L1, EPAS1, MTOR, HIF1A, MYC, NFE2L2, NOTCH1, P4HB, PGK1, PMAIP1, PTGS2, RORA, SFRP1, CITED2, SIRT1, HIPK2, TIGAR, PINK1, CPEB2"
GO:0051894,positive regulation of focal adhesion assembly,1.9242649242649241,8,0.0625,0.018357573901902673,0.02734311462093137,"RAC1, MAP4K4","ABL1, KDR, PTPRJ, ROCK1, SFRP1, TEK, TSC1, NRP1"
GO:0030182,neuron differentiation,1.0300476947535773,2,0.0625,0.01851532283757232,0.01851532283757232,"CDK5, PIN1","RYK, WNT3, WNT2B, WNT9A, WNT9B, FZD5, FZD3, FZD1, FZD8, CDK5R1, FZD10, DDIT4"
GO:0006979,response to oxidative stress,1.324347036111742,1,0.05555555555555555,0.01851532283757232,0.01851532283757232,"GPX4, GSS, NDUFA6, NDUFB4, NDUFS8, PRDX6, RGS14, NDUFA12, NAPRT","ABL1, AKT1, GCLM, NFE2L2, PRKN, PRNP, SGK2, SIRT1, PINK1"
GO:0048013,ephrin receptor signaling pathway,1.1771973654326595,1,0.0625,0.01851532283757232,0.01851532283757232,FYN,"EFNA1, EFNB2, EPHA2, EPHA3, EPHA4, EPHB4, PAK1, PTK2, PTPN11, RASA1, SRC, YES1, CDK5R1, SIPA1L1, ARHGEF28"
GO:0031527,filopodium membrane,2.0012355212355213,9,0.07142857142857142,0.018669245355683674,0.03414633559350757,,"ARF6, ITGA3, ITGAV, ITGB3"
GO:0004438,phosphatidylinositol-3-phosphate phosphatase activity,0.8338481338481338,6,0.0625,0.01909467707356408,0.023577536885219588,MTMR14,"MTM1, MTMR1, SYNJ1"
GO:0030511,positive regulation of transforming growth factor beta receptor signaling pathway,1.2507722007722006,1,0.05555555555555555,0.01920256126831656,0.01920256126831656,MEN1,"CDKN2B, CREBBP, EP300, HSP90AB1, CITED2, HIPK2, FLCN"
GO:0098978,glutamatergic synapse,0.9683397683397683,6,0.0625,0.01969300744840874,0.03698191045153192,"ACTB, APOE, RHOA, HRAS, PIN1, RAC1, STX4, VPS18","ACTN1, GSK3B, ITGB3, NOS1AP"
GO:0042307,positive regulation of protein import into nucleus,1.324347036111742,5,0.0625,0.021432588570023045,0.028890462713399664,"HCLS1, HDAC3","CDH1, EP300, FLNA, JUP, PIK3R1, PSEN1, TPR"
GO:0019902,phosphatase binding,1.1771973654326595,2,0.059027777777777776,0.021432588570023045,0.021432588570023045,MAPK3,"DLG1, DLG3, SMAD2, SMAD3, MAPK1, ELL, WNK1"
GO:0005890,sodium:potassium-exchanging ATPase complex,1.0006177606177606,7,0.0625,0.021521002192457648,0.030992447360035532,"ATP1A3, ATP1B3","ATP1A1, ATP1B1"
GO:0016328,lateral plasma membrane,1.563465250965251,2,0.06458333333333333,0.021667250491302296,0.022590148669443227,"MYO1A, RAB13, SLC22A1","ANK3, APC, ATP1A1, ATP1B1, CDH1, CTNNB1, GNA12, MYO1C, SCN5A, SLC12A2, BVES, VANGL2"
GO:0090200,positive regulation of release of cytochrome c from mitochondria,1.324347036111742,2,0.05555555555555555,0.02314484420139311,0.024956163386860707,"BAD, BAX, BID, TP53, PYCARD, BMF","BNIP3, PMAIP1, PINK1"
GO:0030374,nuclear receptor coactivator activity,1.8344658944658945,2,0.059027777777777776,0.02368511505419679,0.02696134795071699,"ELK1, PKN1, KDM1A","ACTN4, ACTN1, FGF2, MED1, NCOA1, CARM1, NCOA2, PPARGC1B"
GO:0043303,mast cell degranulation,2.0012355212355213,10,0.125,0.02504945686750816,0.04349564858191355,"GRP, PIK3CD, PIK3CG",KIT
GO:2000114,regulation of establishment of cell polarity,1.6676962676962677,2,0.05718954248366013,0.025280366078355758,0.03166486016571222,RACK1,"CDH5, ROCK1, ROCK2"
GO:0035861,site of double-strand break,1.2886743886743885,9,0.0625,0.02712734842827805,0.04721483296254538,"H2AX, RAD51, RPA2, SETMAR, WAS, DYNLL1, ARPC5, ARPC4, ARPC3, ARPC1A, SIRT7, SIRT6","NBN, RBBP8, RPA1, TP53BP1, KAT5"
GO:0002223,stimulatory C-type lectin receptor signaling pathway,0.9728228228228228,5,0.0625,0.02739302408532074,0.036906682392358635,"FYN, TYROBP","CREBBP, EP300, PAK1, SRC, CLEC7A"
GO:0008307,structural constituent of muscle,1.4071187258687257,5,0.0625,0.027430008679793325,0.04564783788486207,"MYL3, MYL5, MYL6, TPM2, MYL6B","ASPH, DAG1, MYH11, TPM1"
GO:0030032,lamellipodium assembly,0.9380791505791505,10,0.0625,0.027430008679793325,0.04564783788486207,RAC1,"ITGB1, KIT, VCL, CYFIP1, WHAMM"
GO:0007259,cell surface receptor signaling pathway via JAK-STAT,0.6822393822393822,7,0.0625,0.028232613941139118,0.047343501259549337,"IFNAR1, IFNAR2","GHR, STAT3, PIAS1, SOCS6"
GO:0045296,cadherin binding,1.9456456456456457,3,0.0625,0.029577802311340624,0.036906682392358635,,"ACVR1, ANK3, APC, BMPR2, CTNNA1, CTNNB1, JUP, KDR, CD46, PTPN11, PTPRB, PTPRJ, VCL, CDK5R1"
GO:0090090,negative regulation of canonical Wnt signaling pathway,1.0775883575883578,5,0.0625,0.030156782566077338,0.04661210829006752,"APOE, GLI1, GSK3A, HDAC1, SOX9, LIMD1, RBX1, MAD2L2, WWTR1, OTUD5","APC, CSNK1A1, DDIT3, GLI3, GSK3B, MCC, PRKN, SFRP1, SNAI2, STK3, FZD6, LATS1, APC2, CHD8, TNN, ZNRF3, NKD1, DAB2IP"
GO:0019888,protein phosphatase regulator activity,1.346985446985447,2,0.06274509803921569,0.0320510189449788,0.0373326289022704,"IGBP1, PPP2R3B, PPP2R2D","GNA12, PPP2R2A, PPP2R5D, EIF2AK2"
GO:0046875,ephrin receptor binding,1.1771973654326595,10,0.0625,0.033264961924699264,0.04632808425343841,"FYN, PIK3CG","ABL1, EFNA1, EFNB2, PTPN1, SHC1, SRC"
GO:1990573,potassium ion import across plasma membrane,0.9380791505791505,7,0.0625,0.03367098687566111,0.04316311741335856,"ATP1A3, ATP1B3","ATP1A1, ATP1B1, KCNJ2, SLC12A2"
GO:0005912,adherens junction,1.731838431838432,4,0.06066176470588235,0.03378774682714913,0.048795710605786954,"ACTB, PPP1CA, LIMD1, FLOT1, CRB1","JAG1, APC, BMPR2, CDH1, CDH5, CTNNB1, JUP, SMAD7, MYO1E, NOTCH1, TJP1, VCL, PLPP3, SNAP23, MAGI1, CYTH3, FRS2, SCRIB, DLL1, PALS1, WNK3, NECTIN4"
GO:0042789,mRNA transcription by RNA polymerase II,1.4482625482625484,2,0.059027777777777776,0.03449240925039182,0.03449240925039182,"ATF4, NR1H2, NR1H3","MED1, RARA, TAF4, TAF4B, THRB, VDR, NCOA1, NCOA2"
GO:0070527,platelet aggregation,1.334157014157014,8,0.0625,0.03450385194691852,0.04859670894754917,"GNAS, PIK3CG, PPIA, FERMT3","ACTN1, ITGB3, PIK3CB, STXBP1"
GO:0007417,central nervous system development,1.2886743886743885,2,0.0625,0.034685148095505956,0.037539259927128914,"ADORA2A, GSTP1, PSPN, SH3GL3","ALDH3A2, NRCAM, PRKN, RPS6KA3, SH3GL2, SLC2A1, ZBTB16, ARNT2, NCKAP1, RPS6KA6, SHC3, PDGFC, B3GNT5"
GO:0005524,ATP binding,1.3698933627505054,1,0.0625,0.03875343267978358,0.03875343267978358,"ACVRL1, BMPR1B, DAPK3, DTYMK, GALK1, GCK, GSS, GUK1, NME1, PIM1, PRKACB, MAP4K2, RAD51, SRPK1, MKNK1, RPS6KA4, MAP4K4, PMVK, MAP4K1, NLRP1, AGAP2","ABL1, ACLY, ACVR1, ACVR1B, AKT1, AKT2, ATP1A1, BMPR1A, CAD, HSPA5, HSP90AA1, HSP90AB1, MAP3K5, MYO1B, MYH9, MYH10, OAS3, PDK2, PEX1, PFKM, PGK1, PPP5C, PRKCI, STK3, TAP1, PIP4K2B, MAP4K3, KSR1, LATS1, RPS6KA5, PPIP5K1, AKT3, MTHFS, CLP1, IRAK3, NT5C2, SIK2, PPIP5K2, PRKAG2, MAP3K20, CHD8, PINK1, WNK1, WNK4, WNK3, WNK2, PANK3, SIK1"
GO:0006470,protein dephosphorylation,1.4139164008729228,2,0.06274509803921569,0.039162640752208,0.048850383901300504,"DUSP2, PPM1B, PPP1CA, PPP2CA, PTPN6, PTPN7, PPP2R3B, SSH2","MTM1, PPP1R12A, PPM1A, PPP2CB, PPP2R2A, PPP2R5D, PPP3CA, PPP5C, PTPN1, PTPN11, PTPN13, PTPRB, PTPRS, PPM1D, CDC14B, BTRC, FBXW11, SSH1"
GO:0016323,basolateral plasma membrane,1.0668351124233477,1,0.058823529411764705,0.03923546858607673,0.03923546858607673,"ADRA2A, AQP1, ATP1B3, KCNJ4, MYO1A, SLC22A1, STX4, FLOT1","ANK3, ATP1A1, CTNNB1, DLG1, EGFR, ERBB2, ERBB3, B4GALT1, KCNQ1, MYO1D, SLC2A1, SLC7A1, SLC12A2, TEK, TFRC, TGFA, TJP1, PLPP3, CLDN1, NOD1, MARVELD2"
GO:1901379,regulation of potassium ion transmembrane transport,1.5009266409266409,1,0.06666666666666667,0.04183250652578544,0.04183250652578544,GNB2,"CACNA1D, KCNN2"
GO:0003713,transcription coactivator activity,1.341407867494824,2,0.08680555555555555,0.04271040944747745,0.04271040944747745,"APBB1, DAXX, HMGB1, NFKBIB, SMARCB1, UBE2L3, MED16, TADA3, RIPK3, PARK7, KDM1A, WWTR1, MED4","ABL1, ACTN4, CREBBP, CTNNB1, EP300, JUP, NOTCH1, MED1, SMARCA2, NCOA3, NCOA1, MED14, MAML1, MED24, MED12, CITED2, YAP1, CARM1, NCOA2, KAT5, WWC1, HIPK2, MAML3, KMT2E"
GO:0007219,Notch signaling pathway,1.5009266409266409,2,0.059027777777777776,0.04286028750010458,0.04286028750010458,RBPJ,"JAG1, HES1, NOTCH1, NOTCH2, SNAI2, MAML1, HEY1, HEY2, DLL1, MAML3, NRARP"
GO:0047498,calcium-dependent phospholipase A2 activity,1.0006177606177606,1,0.0625,0.043244347171490984,0.043244347171490984,PLA2G2A,"PLA2G4A, PLA2G4D, PLA2G4B"
GO:0006355,regulation of DNA-templated transcription,1.2507722007722006,2,0.059027777777777776,0.04368580662003118,0.04368580662003118,"ACVRL1, ATF4, CEBPB, DAPK3, DAXX, E2F1, E2F2, EZH2, GLI1, HCLS1, LYL1, PRKCQ, SOX4, SPI1, TCF7, TP53, UBE2L3, VHL, RPS6KA4, TADA3, HDAC10","ABL1, ACVR1B, AHR, CALR, CEBPA, CREBBP, DDIT3, GLI2, GLI3, HIF1A, IGSF1, SMAD3, MITF, NOTCH1, RBBP4, RORA, SMARCA2, SP1, STAT3, TFDP1, HMGA2, RPS6KA5, TGFBRAP1, CLOCK, ARNT2, NR1D2, CARM1, ZNF274, PAK6, RBAK, PPARGC1B"
GO:0001217,DNA-binding transcription repressor activity,2.144180915609487,2,0.059027777777777776,0.04398977808525666,0.04398977808525666,"SPI1, TCF7","HIF1A, SMAD3, RARA, ZNF418"
GO:0030307,positive regulation of cell growth,1.2128700128700127,1,0.0625,0.04656447048311,0.04656447048311,RPS6KA1,"AKT1, BCL2, CSNK2A1, DDX3X, EGFR, ERBB2, H3-3B, MMP14, RPS6KA3, S100A8, SFRP1, ADAM17, TEAD1, TGFB2, YAP1"
GO:0051973,positive regulation of telomerase activity,1.6081356867071153,1,0.0625,0.046813067016152954,0.046813067016152954,"PRKCQ, MAPK3, MAP2K7","HSP90AA1, HSP90AB1, MYC, MAPK1, KLF4, NEK7"
GO:0097191,extrinsic apoptotic signaling pathway,1.4664225802156836,1,0.0625,0.04885900241746163,0.04885900241746163,"BAD, BAX, GSK3A, SIVA1","ACVR1B, FAS, GSK3B, IL6R, IL12A, INHBA, SMAD3, PDPK1, TGFB2, TLR3, FADD, TNFRSF10A, RNF41"
