ID,Term_Description,Fold_Enrichment,occurrence,support,lowest_p,highest_p,Up_regulated,Down_regulated
GO:0006661,phosphatidylinositol biosynthetic process,1.1230715895302479,10,0.2857142857142857,4.869478460154647e-19,4.70521607093993e-15,"IMPA1, MTM1, PIK3C2A, PTEN, INPP4B, SYNJ1, SYNJ2, MTMR2, MTMR6, FIG4, INPP5F, SACM1L, PIKFYVE","INPPL1, OCRL, PI4KB, CDIPT, PIP5K1C, INPP5J, INPP5K, PI4K2A, INPP5E, MTMR14, SLC27A1"
GO:0007249,canonical NF-kappaB signal transduction,1.263455538221529,10,0.26785714285714285,6.334755995204448e-19,0.01699389985626037,"BIRC2, BIRC3, CHUK, ROCK1, MAP3K7, TRAF6, RIPK2, ROCK2, TBK1, TLR8, ZNF675","AKT1, BCL3, IRAK1, NFKB2, NFKBIA, RELA, IKBKG, TRADD, MAP3K14, CARD11"
GO:0005747,mitochondrial respiratory chain complex I,1.418616744669787,10,0.16666666666666666,1.0642758482227017e-15,2.196763022122069e-8,"NDUFA5, NDUFA7, NDUFB8, NDUFV2","NDUFA1, NDUFA2, NDUFA3, NDUFA4, NDUFA6, NDUFA8, NDUFA10, NDUFAB1, NDUFB1, NDUFB2, NDUFB3, NDUFB4, NDUFB6, NDUFB7, NDUFB9, NDUFB10, NDUFC1, NDUFS2, NDUFS3, NDUFV1, NDUFS5, NDUFS6, NDUFS8, NDUFV3, NDUFB11, NDUFA12, NDUFA11, NDUFS7"
GO:0004674,protein serine/threonine kinase activity,1.214959265037268,10,0.5,1.153607792812402e-12,4.124229056050292e-11,"ACVR2A, ACVR2B, ATM, ATR, BMPR1A, BMPR1B, BRAF, BUB1, CAMK2D, CSNK1A1, CSNK1G3, GSK3B, ILK, MAP3K1, MAP3K5, PDK3, PRKAA1, PRKAA2, PRKCE, PRKCI, PKN2, PRKDC, MAPK6, MAPK8, MAP2K6, EIF2AK2, RAF1, ROCK1, RPS6KA3, RPS6KB1, SRPK1, STK3, STK4, MAP3K7, TGFBR1, MAP4K3, MAPKAPK5, RIPK2, LATS1, RPS6KA5, MAP4K4, EIF2AK3, ROCK2, SLK, AKT3, HIPK3, PLK4, IRAK3, SMG1, HIPK2, TBK1, IRAK4, TAOK3, MAP3K20, CSNK1G1, TAOK1, WNK3, LRRK2, ACVR1C, NEK7, PIKFYVE, KSR2","ACVR1B, ACVRL1, AKT1, ARAF, CDK5, CDK9, PLK3, CSNK1D, CSNK1E, CSNK1G2, CSNK2B, DAPK3, GRK5, MKNK2, GSK3A, IRAK1, LIMK1, MAP3K10, MAP3K11, PDPK1, PHKG2, PIM1, PRKACA, PRKCD, PKN1, PRKCZ, MAPK3, MAPK4, MAPK11, MAPK13, MAP2K1, MAP2K2, MAP4K2, RPS6KA1, RPS6KA2, RPS6KB2, MAPK12, STK11, MAPKAPK3, ULK1, RPS6KA4, MAP3K14, PKMYT1, MAPKAPK2, TAOK2, OXSR1, PAK4, RIPK3, PIM2, MAP4K1, CHEK2, DAPK2, PRKD2, STK39, PINK1, WNK2, SIK1"
GO:0032981,mitochondrial respiratory chain complex I assembly,1.3160995189807592,10,0.16666666666666666,2.4774602263723544e-12,3.1788408760773786e-5,"NDUFA5, NDUFB8","NDUFA1, NDUFA2, NDUFA3, NDUFA6, NDUFA8, NDUFA10, NDUFAB1, NDUFB1, NDUFB2, NDUFB3, NDUFB4, NDUFB6, NDUFB7, NDUFB9, NDUFB10, NDUFC1, NDUFS2, NDUFS3, NDUFS5, NDUFS8, NDUFB11, NDUFA11, NDUFS7"
GO:0001228,"DNA-binding transcription activator activity, RNA polymerase II-specific",1.195063358089879,10,0.26785714285714285,2.4970051783122187e-12,5.326083853634942e-10,"KLF5, CREB1, ATF2, ELK4, ESR1, ETS1, FOXO1, FOXO3, GTF2I, HIF1A, HNF4G, ONECUT1, RBPJ, SMAD2, SMAD4, MEF2A, MEF2C, MITF, NFATC3, NOTCH2, PGR, REL, SP1, ZNF143, CLOCK, NR1I3, ATF6, ZNF300","CEBPA, ATF6B, DBP, DDIT3, E2F2, E2F3, E2F4, EGR1, EGR2, ELK1, ESRRB, FOS, GATA3, GATA4, HHEX, NR4A1, HSF1, IRF1, IRF3, IRF5, JUN, FOXO4, NFATC1, NFE2L2, NFKB2, NFYB, NOTCH1, NOTCH4, NRF1, NR4A2, RELA, RXRB, SOX4, SREBF1, SRF, STAT3, STAT5B, STAT6, TCF3, TFAP4, TP53, TP73, NR1H2, ZNF76, ZBTB17, RFXANK, CREB3, PRDM4, MLXIP, POU2F3, FOXP3, SOX17, CREB3L3, CREB3L1, MEF2B"
GO:0043123,positive regulation of canonical NF-kappaB signal transduction,1.1535898392457438,6,0.16666666666666666,2.4239317750675048e-11,5.971726783296121e-10,"BIRC2, BIRC3, XIAP, CHUK, HTR2B, IL1B, ILK, ROR1, PRKN, REL, MAP3K7, TFRC, TLR4, TNF, TRAF5, TRAF6, UBE2V1, RIPK2, CFLAR, BCL10, TLR6, AKAP13, FBXW11, TBK1, IRAK4, CLEC7A, TIFA, CLEC6A, TAB3","RHOA, CAV1, CD4, CD36, CD74, CX3CR1, FLOT2, GAPDH, HLA-DRB1, IRAK1, LTBR, MAP3K3, MYD88, RELA, CCL19, CCL21, CX3CL1, TGFB1, TNFRSF1A, UBE2N, IKBKG, TRADD, FADD, RBX1, FLOT1, LAMTOR5, RBCK1, PIM2, CARD9, PINK1, SHARPIN, CARD11, TICAM1, DAB2IP"
GO:0006954,inflammatory response,0.9781591263650546,6,0.16666666666666666,3.57315681245377e-11,1.263085541461967e-7,"ADORA2A, PARP4, CHUK, CYBB, FCGR2B, IL1B, IL5, CXCL8, IL10RB, MEFV, NFATC3, PIK3CG, MAP3K7, THBS1, TNF, WNT5A, RIPK2, HDAC9, LIAS, TBK1, NOX4, MAP3K20, NLRC4, NLRP3, MIR221","ADORA1, AGER, CEBPB, CYBA, FOS, FUT7, GATA3, XCR1, HMGB1, HRH1, KIT, NFATC4, PIK3CD, RELA, CCL3, STAT3, TNFRSF1A, HYAL3, IKBKG, AOC3, MAPKAPK2, HDAC5, MGLL, PLA2G2D, NOX1, F11R, IL17D, NRROS, CCL3L3"
GO:0038061,non-canonical NF-kappaB signal transduction,1.1581675767030681,6,0.16666666666666666,1.3299216431395845e-10,1.0106207965981424e-6,"BIRC2, BIRC3, CHUK, TRAF6, TAB3","AKT1, NFKBIA, RELA, TRAF2, MAP3K14, TAB1"
GO:0051092,positive regulation of NF-kappaB transcription factor activity,1.0437241402699586,8,0.26785714285714285,5.971726783296121e-10,0.023238833636859538,"AGT, CHUK, FER, IL1B, ROR1, PRKCH, PRKCI, EIF2AK2, PSMA6, TFRC, TLR2, TLR4, TNF, TRAF5, TRAF6, UBE2V1, WNT5A, RIPK2, TNFRSF11A, IL18RAP, IL18R1, CFLAR, BCL10, TNFSF18, RPS6KA5, AIM2, CLOCK, MALT1, IRAK3, NLRC4, CLEC7A, NLRP3","AGER, IL18, IRAK1, MYD88, NTS, PLA2G1B, PPIA, PRKCZ, RELA, RPS3, STAT3, TRAF2, UBE2N, IKBKG, TRADD, RPS6KA4, ARHGEF2, LAMTOR5, RBCK1, RIPK3, PRKD2, PYCARD, PIDD1, CARD9, CARD11"
GO:0000981,"DNA-binding transcription factor activity, RNA polymerase II-specific",1.174120298145259,10,0.5,1.3569812731038214e-9,1.3067559238080046e-5,"CREB1, ETS1, HIF1A, MEF2A, MEF2C, POU2F1, POU5F1, TEAD1, CLOCK","ARNT, ATF4, RUNX3, CEBPB, E2F1, EGR2, ELK1, ESRRB, NR5A1, GATA3, NR4A1, HSF1, IRF1, IRF3, IRF5, IRF7, JUN, MAX, MEF2D, NFATC1, RELA, SPI1, SREBF1, STAT2, STAT3, TFAP4, TFE3, TP53, TP73, BHLHE40, KLF2, CREB3, HEY1, HEY2, HEYL, SOX17, FOXO6"
GO:0046854,phosphatidylinositol phosphate biosynthetic process,1.3236200876606492,6,0.16666666666666666,2.0516658228608416e-9,3.125691474896167e-9,"PIK3C3, PIK3CA, PIK3CB, PIK3CG, PIK3R1, SMG1","ITPKB, IP6K1, IP6K2, PI4K2A, ITPKC"
GO:0005891,voltage-gated calcium channel complex,1.263455538221529,10,0.16666666666666666,4.7222886467852185e-8,0.004622792119653011,"CACNA1C, CACNA1D, CACNA2D1, CACNB2, CACNB4, PDE4B","CACNA1F, CACNB3, CACNA1G"
GO:0004438,phosphatidylinositol-3-phosphate phosphatase activity,1.1230715895302479,10,0.2857142857142857,5.0511019474248385e-8,5.256730544914084e-4,"MTM1, PTEN, SYNJ1, SYNJ2, MTMR2, MTMR6, SACM1L",MTMR14
GO:0071260,cellular response to mechanical stimulus,1.1371099843993762,7,0.16666666666666666,8.707583055365104e-8,0.016981583574846137,"FAS, CASP5, IL1B, MAP3K1, MAPK8, MAP2K4, TLR4, BCL10, MAP3K2, TLR8","AQP1, BAD, BAK1, BNIP3, CASP2, TNFRSF8, IRF1, LTBR, MYD88, PDE2A, MAPK3, SLC9A1, TNFRSF1A, TNFSF14, FADD, MAP3K14, F11R"
GO:0004712,protein serine/threonine/tyrosine kinase activity,1.3783151326053042,10,0.26785714285714285,1.2083696515773103e-7,3.1401569798677434e-7,"PRKAA2, RPS6KB1","AKT1, PRKACA, PRKCG, MAP2K1, MAP2K2, RPS6KA1, RPS6KA2"
GO:0006468,protein phosphorylation,1.1955278211128446,10,0.5,1.5901576733273895e-7,2.1759857831794385e-5,"ADAM10, ATM, BRAF, CAMK4, CAMK2D, CCNE1, CDK6, CHUK, CREB1, CSNK1A1, FER, GSK3B, ILK, JAK1, JAK2, LYN, MAP3K5, MYLK, PRKAA1, PRKAA2, PRKCA, PRKCE, PRKCH, PRKCI, PKN2, PRKDC, PRKG1, MAPK6, MAPK8, MAPK10, EIF2AK2, RAF1, ROCK1, RYK, CCL11, SRPK1, STK3, STK4, TEC, TXK, MAP4K3, LATS1, RPS6KA5, MAP4K4, EIF2AK3, ROCK2, AKT3, HIPK3, MERTK, PLK4, IRAK3, PRKD3, HIPK2, TBK1, TAOK3, MAP3K20, BIRC6, FNIP2, WNK3, STRADA, IP6K3, LRRK2, GLYCTK, NEK7, HIPK1","AKT1, BCR, CAMK2B, RUNX3, CDC25B, CDK4, CDK5, CDK9, PLK3, CSK, CSNK1D, CSNK1E, CSNK1G2, CTBP1, DAPK3, ERBB2, PTK2B, FGR, GAS6, MKNK2, GSK3A, IGFBP3, JAK3, LCK, LIMK1, LIPE, MATK, MAP3K11, PDGFB, PDPK1, PHKG2, PIM1, PRKAB1, PRKACA, PRKAG1, PRKCD, PRKCG, PKN1, PRKCZ, MAPK3, MAPK4, MAP2K1, MAP4K2, RARA, RET, RPS6KA1, CCL2, STK11, TYK2, ZAP70, RPS6KA4, MAP3K6, MAPKAPK2, MAML1, OXSR1, CAMKK2, PIM2, MAP4K1, CHEK2, DAPK2, PRKD2, STK39, PKN3, PINK1, WNK2, ADM2, SIK1"
GO:0005245,voltage-gated calcium channel activity,1.1526261050442017,10,0.16666666666666666,1.7166451891904776e-7,0.0054100260164311196,"CACNA1C, CACNA1D, CACNA1E, CACNA2D1, CACNB2, CACNB4, ITGAV","CACNA1A, CACNA1F, CACNB1, CACNB3, RYR1, TRPV1"
GO:0003700,DNA-binding transcription factor activity,1.1681584051683236,10,0.16666666666666666,1.7664490917671145e-7,1.0150274246701772e-5,"AHR, CREB1, ATF2, ETS1, FOXO1, FOXO3, GLI3, HIF1A, HNF4G, RBPJ, SMAD2, SMAD4, SMAD9, MEF2A, MEF2C, NR3C2, POU5F1, REST, RORA, SP1, STAT4, TCF7L2, ZEB1, TEAD1, CLOCK, CREB5, NR1I3, ATF6","ARNT, ATF4, BCL6, RUNX3, CEBPA, ATF6B, DDIT3, E2F1, E2F3, E2F4, EGR1, EGR2, ELK1, ESRRB, FOS, GATA3, GATA4, GLI2, FOXA2, PDX1, IRF3, JUN, FOXO4, NFATC1, NFE2L2, NFKB2, NFYB, NFYC, POU2F2, PPARD, RARA, RELA, RORC, RXRA, SOX4, SPI1, SREBF1, SRF, STAT2, STAT3, STAT5A, STAT5B, STAT6, HNF1B, TCF3, TEAD4, TEAD3, TFE3, TGIF1, THRA, TP53, TP73, VDR, XBP1, ZNF133, ZBTB17, TFEB, TEAD2, KLF2, BATF, HEY1, HEY2, HEYL, FOXP3, HES6, ZNF746, MAFA"
GO:0018108,peptidyl-tyrosine phosphorylation,1.0682876095531626,10,0.16666666666666666,1.8661954629881992e-7,8.356266423350644e-5,"ABL2, EPHA3, ERBB4, FER, JAK2, KDR, LYN, PDGFRA, PTK2, ABI2","ABL1, EPHA4, ERBB2, PTK2B, FES, FGFR1, FGFR4, FGR, FLT4, JAK3, LCK, PDGFB, PDGFRB, PTPN6, SRC, ZAP70"
GO:1901224,positive regulation of non-canonical NF-kappaB signal transduction,1.1055235959438379,9,0.2857142857142857,1.9589575405954666e-7,0.038638086345548744,"DDX3X, IL1B, NR3C2, EIF2AK2, MAP3K7, TLR2, TLR4, TNF, IL23A, NLRP3","ACTN4, AGER, RELA, RPS3, CCL19, TRIP6, VCP, TNFSF14, PHB2, PYCARD, NLRP12"
GO:0046982,protein heterodimerization activity,1.123071589530248,10,0.18333333333333335,3.363956169527237e-7,3.147898267303647e-4,"ADCY8, AHR, BARD1, BCL2, CHUK, CYBB, HIF1A, MEF2A, MEF2C, PAFAH1B1, TLR4, TLR6, IRAK3, ATF6, RALGAPB, RALGAPA2, ALG2, RALGAPA1","ADRA1B, ADRA2A, ADRA2C, AGTR1, ARNT, ATF4, ATP1A1, ATP1B1, ATP1B2, BAK1, BAX, BMP6, CD247, CYBA, DDIT3, EPAS1, ERBB2, ERBB3, EXT2, HIP1, NR4A1, HSF1, IL12A, IRAK1, ITGA3, KRT10, NR4A2, P4HB, PAFAH1B3, PDGFA, PDGFB, PPP2R1A, SLC3A2, SUPT5H, TCF3, MLX, TP53, TPM2, XBP1, YWHAE, YWHAH, SMC1A, FZD4, IKBKG, BHLHE40, AOC3, GABBR2, RRAGA, PHB2, MLXIPL, RRAGC, CREB3L3, SLC51B, TUBB2B"
GO:0070498,interleukin-1-mediated signaling pathway,1.3476859074362977,10,0.2857142857142857,5.869954768486387e-7,1.7326816756296132e-6,"IL1B, IL1RAP, MAP3K7, TRAF6, RPS6KA5, IRAK3, PLCB1, IRAK4","EGR1, IRAK1, MYD88, NFKBIA, MAPK3, RELA, RPS6KA4, TOLLIP"
GO:1902895,positive regulation of miRNA transcription,1.138248232632008,7,0.16666666666666666,8.279035981299894e-7,0.04307148402574474,"AGT, KLF5, ETS1, FOXO3, HIF1A, IL10, NOTCH2, TEAD1, TNF","EGR1, FOS, GATA3, JUN, NGFR, NOTCH3, PDGFB, RELA, SMARCA4, SPI1, SREBF1, SRF, STAT3, TGFB1, TP53, APLN"
GO:0006120,"mitochondrial electron transport, NADH to ubiquinone",1.4439491865388903,10,0.16666666666666666,8.311254327242432e-7,2.0541643178861597e-6,NDUFV2,"NDUFS2, NDUFS3, NDUFV1, NDUFS8, NDUFS7"
GO:0016303,1-phosphatidylinositol-3-kinase activity,1.3476859074362977,6,0.16666666666666666,1.2330114749575299e-6,1.6841731736792231e-6,"ATM, PIK3C2A, PIK3C2G, PIK3C3, PIK3CA, PIK3CB, PIK3CG",PIK3CD
GO:0004143,ATP-dependent diacylglycerol kinase activity,1.0720228809152366,6,0.16666666666666666,2.687128451933818e-6,3.096692617819288e-4,"DGKG, DGKE, DGKI, DGKH","DGKA, DGKQ, DGKZ"
GO:0004672,protein kinase activity,1.2451445883922312,10,0.42857142857142855,4.415024513647615e-6,0.001438817257875702,"ABL2, GRK3, ATR, BRAF, BUB1, CHUK, CSNK1A1, CSNK1G3, GSK3B, MAP3K1, MAP3K5, PDGFRA, PDK1, PDK3, PIK3CG, PRKAA1, PRKAA2, PRKCA, PRKCE, PRKCH, PRKCI, PKN2, PRKDC, PRKG1, EIF2AK2, RAF1, ROCK1, RPS6KA3, RPS6KB1, MAP2K4, SRPK1, STK3, STK4, TGFBR1, MAP4K3, EIF2AK3, AKT3, HIPK3, MAP3K2, SMG1, HIPK2, EEF2K, NME7, TAOK1, WNK3, STRADA, LRRK2","ABL1, GRK2, AKT1, ARAF, CAD, CDK5, CDK9, CSNK1D, CSNK1E, EPHA4, IRAK1, MAP3K3, MAP3K10, MAP3K11, PDGFRB, PDK2, PRKAB1, PRKACA, PRKAG1, PRKCD, PRKCG, PKN1, PRKCZ, MAP2K1, MAP2K5, GRK1, RPS6KB2, CCL2, CCL3, CCL5, SRC, MAP3K14, MAPKAPK2, RIPK3, PRKD2, PKN3, PINK1, MAPK15"
GO:0032743,positive regulation of interleukin-2 production,1.263455538221529,10,0.2857142857142857,5.0246780648071525e-6,0.04689542778728982,"CD28, IL1A, IL1B, PDE4B, PTPRC, MAP3K7, TRAF6, MALT1, GLMN, CLEC7A, CCR2","RPS3, TRAF2, PRKD2, CARD11"
GO:0018105,peptidyl-serine phosphorylation,1.1683567342693708,10,0.2857142857142857,6.517870835090919e-6,0.01940491257084673,"ATM, ATR, CAMK2D, CSNK1A1, GSK3B, PDK3, PRKCA, PRKCE, PRKDC, MAPK8, ROCK1, RPS6KA3, RPS6KB1, STK4, TGFBR1, EIF2AK3, ROCK2, HIPK3, SMG1, HIPK2, TBK1, CAB39, LRRK2, RICTOR","GRK2, AKT1, CAMK2B, CDK5, DGKQ, MAP3K10, PCK1, PRKACA, PRKCD, PRKCZ, MAPK13, MAPK12, MAPKAPK3, ULK1, MAPKAPK2, MAP4K1, PRKD2, STK39, PINK1"
GO:0032755,positive regulation of interleukin-6 production,1.141185647425897,10,0.2857142857142857,8.853962081543079e-6,0.002481053336501596,"EREG, IFNG, IL1A, IL1B, PTPN11, TLR1, TLR2, TLR4, TNF, TNFSF4, WNT5A, TLR6, RIGI, TLR8, CLEC7A, IL33, MIR92A1","AGER, CD74, CYBA, HMGB1, HSPD1, LBP, LPL, MYD88, NOS2, POU2F2, MAPK13, RELA, STAT3, TGFB1, TYROBP, XBP1, HYAL2, ARHGEF2, LILRA2, IL17RA, PYCARD, IL17D, SPHK2, CARD9, LILRA5"
GO:0008137,NADH dehydrogenase (ubiquinone) activity,1.310250187785289,10,0.16666666666666666,9.661753816245969e-6,2.375124444991907e-5,NDUFV2,"NDUFB7, NDUFS2, NDUFS3, NDUFV1, NDUFS8, NDUFS7"
GO:0046856,phosphatidylinositol dephosphorylation,1.1662666506660266,10,0.2857142857142857,9.794038163351143e-6,0.0011437999073434534,"MTM1, PTEN, SYNJ1, MTMR2, MTMR6, INPP5F, SACM1L","INPP5K, PIP4P1"
GO:0030168,platelet activation,0.8182378723720377,6,0.16666666666666666,1.3164411670851226e-5,4.907875752297907e-4,"DGKG, PIK3CA, PIK3CB, DGKE, DGKI, DGKH","DGKA, DGKQ, F2, LCK, PF4, PPIA, SRC, VAV2, VWF, DGKZ, F2RL3"
GO:0090575,RNA polymerase II transcription regulator complex,1.1310935294554638,10,0.18333333333333335,1.463659959737671e-5,0.004115482283727933,"CREB1, ATF2, HIF1A, POU2F1, STAT4, THRB, NCOA2, ATF6, HIPK2","ANXA2, ARNT, ATF4, CEBPA, CEBPB, CHD4, ATF6B, DBP, DDIT3, E2F1, E2F2, E2F3, FOS, NR5A1, GATA4, JUN, JUNB, JUND, MAX, NFE2L2, NFYB, NFYC, RARA, RXRA, RXRB, S100A10, STAT3, STAT6, TCF3, NR1H2, VDR, XBP1, RFXANK, HYAL2, NR1H3, CREB3, BATF, BATF2"
GO:0000976,transcription cis-regulatory region binding,1.1760466645080898,10,0.16666666666666666,2.1000706908815012e-5,0.0024281391224052077,"AHR, BRCA1, ERBB4, ETS1, FOXO3, SMAD4, MEF2C, POU5F1, REST, SMARCA2, SP1, TCF7L2, TNF, PIAS1, NCOR1, ATF6, ZNF658, TBL1XR1, SUV39H2, ZNF568, ZNF808","ATF4, CEBPA, CEBPB, ATF6B, CRY2, DDIT3, EGR1, EGR2, ELK1, FOS, GATA3, GATA4, HHEX, HMGB1, FOXA2, HSF1, IRF1, JUN, JUND, SMAD6, MEN1, NFATC4, NFE2L2, NFYB, NFYC, POU2F2, RELA, RXRA, SOX4, SPI1, STAT3, SUV39H1, TBL1X, TBP, TFAP4, TFE3, THRA, TP53, TP73, TFEB, ASH2L, NR1D1, HDAC5, NR1H3, CARM1, BRD7, TBX21, MACROH2A2, PRDM16, SOX17, CREB3L3, CREB3L1, ZNF746"
GO:0071276,cellular response to cadmium ion,1.2032909887824084,6,0.22619047619047616,2.3141483845441564e-5,0.0013029430124002702,"CHUK, MAPK8","AKT1, DAXX, FOS, HSF1, JUN, MAPK3, SUMO1, NCF1"
GO:0006355,regulation of DNA-templated transcription,1.1824647985919434,10,0.16666666666666666,3.369179567702482e-5,0.015711761881831546,"ACVR2B, AHR, ATF2, ESR2, GLI3, HIF1A, MEF2C, MITF, PGR, POU5F1, RB1, RORA, SMARCA2, SP1, TGFBR1, UBE2V1, KAT2B, RPS6KA5, CLOCK, NR1D2, IFNK, RBAK, ZNF350, PPARGC1B","ABL1, ACVR1B, ACVRL1, ATF4, CALR, CEBPA, CEBPB, DAPK3, DAXX, DDIT3, DVL1, DVL2, E2F1, E2F2, ESRRB, GATA4, KAT2A, GLI2, HCFC1, IGSF1, LYL1, FOXO4, NFKB2, NFYB, NFYC, NOTCH1, PML, RELA, SOX4, SPI1, STAT3, TP53, UBE2L3, ZNF74, FZD7, ZNF282, RPS6KA4, TGFBRAP1, MAGED1, TADA3, CARM1, WDR5, CHEK2, SUFU, HES6, PAK6, SOX17, HDAC10, MAFA"
GO:0060402,calcium ion transport into cytosol,1.4038394869128097,10,0.16666666666666666,3.844577300993017e-5,8.14523277100531e-5,"CACNA1C, CACNA2D1, RYR2, SLC8A1",CACNB3
GO:0009615,response to virus,1.038456606757421,1,0.16666666666666666,4.580575135480776e-5,4.580575135480776e-5,"APOB, CDK6, CHUK, DDX3X, IFNAR1, IFNAR2, IFNG, EIF2AK2, PSMA2, CCL11, TNF, TNFSF4, RIGI, TBK1, TLR8, IFNK","BCL3, BST2, CFL1, AP1S1, ENO1, FGR, GATA3, HSPB1, IL12A, IRF7, STMN1, OAS1, ODC1, CCL5, CCL19, CCL22, XCL1, SMPD1, HYAL3, IKBKG, HYAL2, ISG15, LAMTOR5, LILRB1, PIM2, IL17RA, TBX21, FOXP3, DHX58"
GO:0042981,regulation of apoptotic process,1.1639105564222567,6,0.16666666666666666,4.989985389614509e-5,0.011140795113760212,"APAF1, BIRC2, BIRC3, XIAP, ATM, NAIP, RAF1, SKP2, SLK, TOMM70, MALT1, GLS2, ACER2","AKT1, BAX, BCL2L2, BCL3, CALR, CDK5, CTSB, DAPK3, HIP1, HSP90AA1, IRF3, PTPN6, RPS3, TP53, TRAF2, VCP, TNFSF9, MAGED1, BCAR1, RIPK3, TARDBP, DAPK2, IFT57, BIRC7, AKT1S1"
GO:0046488,phosphatidylinositol metabolic process,1.6846073842953717,10,0.30952380952380953,6.655719705870549e-5,1.47052757592581e-4,"SYNJ1, PLCB1, IP6K3","PDGFRB, PLCB2, PLCB3, PLCD1, PLCG1, PLA2G3"
GO:2001240,negative regulation of extrinsic apoptotic signaling pathway in absence of ligand,0.9909455201737482,10,0.2857142857142857,7.357808915303156e-5,0.019509284407237204,"BCL2, IL1A, IL1B, TNF","AKT1, BCL2L1, PF4, MAPK7, MAP2K5, UNC5B"
GO:0032731,positive regulation of interleukin-1 beta production,1.3148155194500464,10,0.2857142857142857,7.575562764390905e-5,0.013942345416786447,"IFI16, IFNG, JAK2, MEFV, TLR4, TNF, WNT5A, RIPK2, AIM2, TLR6, MALT1, CARD8, TLR8, NLRC4, CLEC7A, NLRP3","AGER, CD36, EGR1, HSPB1, LPL, MYD88, RELA, CCL3, CCL19, STAT3, TYROBP, LILRA2, NLRP1, PYCARD, GSDMD, LILRA5"
GO:0043536,positive regulation of blood vessel endothelial cell migration,1.2144843933292215,6,0.16666666666666666,8.334017829139497e-5,0.0021702536828396533,"ANGPT1, ETS1, FGF2, GAB1, HIF1A, KDR, PRKCA, SP1, ADAM17, THBS1, AKT3, MIR221","AKT1, ATP5F1A, ATP5F1B, FGFR1, HMGB1, HSPB1, NOS3, PDGFB, PDPK1, PLCG1, MAP2K3, STAT5A, TGFB1, TMSB4X, FGF18, PRKD2, ANGPT4, MIR126, MIR210"
GO:0034614,cellular response to reactive oxygen species,1.2032909887824084,5,0.16666666666666666,9.271419920307627e-5,0.04933808448244619,"ATM, CHUK, FER, MMP3, PDGFRA, PEX13, MAPK8, LRRK2","AKT1, FOS, JUN, MAPT, PDK2, PEX14, MAPK3, PXN, PEX5, RPS3, CAMKK2, NCF1"
GO:0052629,"phosphatidylinositol-3,5-bisphosphate 3-phosphatase activity",1.0107644305772232,10,0.26785714285714285,1.3188138264245318e-4,0.011856053817525006,"MTM1, SYNJ1, SYNJ2, MTMR2, MTMR6",MTMR14
GO:0004435,phosphatidylinositol phospholipase C activity,0.9752990119604783,10,0.30952380952380953,1.4632786129916195e-4,0.012159211478916198,"CHRM5, EDNRA, PLCB1, PLCZ1","CASR, PLCB2, PLCB3, PLCD1, PLCG1, CCL5, PLCH2"
GO:0043491,phosphatidylinositol 3-kinase/protein kinase B signal transduction,1.1955278211128444,6,0.16666666666666666,1.532914612260425e-4,0.004789413016908092,"HTR2A, HTR2B, LRP2, NF1, PIK3CA, PIK3CB, PIK3CG, PIK3R1, PTEN, ATG14, PIK3R4","AKT1, ZFP36L1, PLK3, EPHA2, ERBB2, ERBB3, GATA3, PIK3CD, STAT3, TSC2, THEM4"
GO:0007186,G protein-coupled receptor signaling pathway,1.017121439574564,6,0.16666666666666666,1.67495902761687e-4,0.008814981703023446,"ABCA1, GRK3, AGT, AVPR1B, CCR8, FPR1, FPR2, HTR2B, HTR4, CXCL8, LHCGR, MC2R, P2RY1, PDE3B, PIK3CB, PIK3CG, PLCB4, PTGFR, TSHR, RAPGEF2, CXCR6, FRS2, AKAP13, PLCB1, ARHGEF12, ACKR4, GHRL, SUCNR1","ADRA1D, ADRA1B, ADRA2A, ADRA2B, ADRA2C, GRK2, AGTR1, APLNR, AKT1, APOA1, APOE, ADGRB1, C3, CALM1, CALM3, CASR, CD3E, CGA, CCR7, CX3CR1, DGKQ, AKR1C2, S1PR1, GCG, GNA12, GNAI2, CCR10, XCR1, GPER1, GRK5, GRK6, HRH1, ITPR3, NTSR1, PDE4A, PLCB2, PLCB3, NPY4R, PTGER1, PTH1R, PTH2R, PTPN6, RGS3, SCTR, CCL5, CCL21, CCL25, CX3CL1, SST, SSTR5, TBXA2R, UCN, VIP, VIPR1, S1PR4, RGS9, LPAR2, S1PR2, BCAR1, GABBR2, ARHGEF11, NMUR1, RGS14, GPR83, RASD1, INPP5K, PIK3R6, NPW"
GO:0034142,toll-like receptor 4 signaling pathway,1.2412896515860634,6,0.16666666666666666,1.989119256243378e-4,0.0072053513960026365,"CHUK, MAP3K7, TLR4, TRAF6, TBK1, PIK3AP1, TICAM2","IRF3, MYD88, NFKBIA, OAS1, RELA, ECSIT, TICAM1"
GO:0035556,intracellular signal transduction,1.0404927961824357,8,0.16666666666666666,2.529420555591225e-4,0.012074042256035492,"DDX3X, FER, GSK3B, CXCL8, JAK2, SMAD2, SMAD4, MAP3K4, MTCP1, NOTCH2, SRPK1, STK3, STK4, TFRC, TGFBR1, MAP4K3, RPS6KA5, MAP4K4, RAPGEF2, MAP3K2, PDCD10, CAB39, WNK3, LRRK2","ADRA1B, AKT1, DAPK3, ERBB2, MKNK2, HMOX1, HSPB1, JAK3, STMN1, LCK, MAP3K3, NFATC1, PDPK1, PLA2G1B, MAP4K2, RAC1, RAC3, RELA, SRC, TYROBP, LAT2, YWHAE, TCL1A, SQSTM1, RPS6KA4, OXSR1, RAPGEF3, RRAGA, DAPK2, FKBP8, PRKD2, LAT, STK39, SIRPG, PINK1, WNK2, SIK1, DAB2IP, FLCN"
GO:0016301,kinase activity,1.2995542678850012,6,0.16666666666666666,3.446406046034625e-4,4.907875752297907e-4,"GSK3B, PIK3C3, PIK3CA, PIK3CB, PIK3CG, PKN2, EIF2AK2, DGKE, PRKD3, IRAK4, TAOK1, LRRK2","ABL1, AKT1, CDK5, CDK9, DGKA, EPHA4, IRAK1, PIK3CD, CCL3, DGKZ, PKMYT1, STK39, TRIB3, PINK1, MAPK15"
GO:0019221,cytokine-mediated signaling pathway,1.2129173166926677,10,0.5,3.523929598610052e-4,8.891077698723584e-4,"CBL, EREG, FER, IL1A, IL1B, IL6ST, IL7, JAK1, JAK2, LIFR, PIK3R1, PTPN11, PTPRJ, SOS1, SOCS5, IRAK3, IFNK, CRLF2, ZNF675, CCR2","AKT1, IL2RB, IL12RB1, IRF5, KIT, PF4, PRKACA, PTPN6, RELA, CCL2, CX3CL1, TNFRSF1A, TYK2, SOCS1, NUMBL, DUOX1"
GO:0038095,Fc-epsilon receptor signaling pathway,0.9954498179927197,7,0.16666666666666666,3.9116847357130034e-4,5.308888100780983e-4,"FER, LYN, MAP3K1, MAPK8, MAPK10, MAP2K4, SOS1, MAP3K7, TRAF6","FCER1G, PLCG1, MAP2K7, VAV2"
GO:0046339,diacylglycerol metabolic process,1.263455538221529,6,0.16666666666666666,4.068429148846668e-4,0.027418145246821568,"DGKG, DGKE, DGKH","DGKA, DGKQ, DGKZ, DGAT1, PGS1, DGAT2"
GO:0038096,Fc-gamma receptor signaling pathway involved in phagocytosis,1.0949947997919918,10,0.16666666666666666,4.328804613087148e-4,0.016035371318439892,"LYN, PRKCE, PTK2, YES1","ABL1, FGR, LIMK1, PLD2, PRKCD, SRC, VAV2, PLA2G6, MYO1G"
GO:0004713,protein tyrosine kinase activity,1.168911246245768,8,0.16666666666666666,4.8245434455688823e-4,0.010311233135990333,"ABL2, ERBB4, JAK1, JAK2, KDR, LYN, MET, PTK2, RYK, WEE1, YES1, RPS6KA5","ABL1, AXL, BCR, CSK, EPHA4, ERBB2, ERBB3, PTK2B, FES, FGFR1, FGFR3, FGR, JAK3, KIT, LCK, MATK, PDGFRB, RET, SRC, TYK2, ZAP70, CAMKK2"
GO:0086091,regulation of heart rate by cardiac conduction,1.6043879850432112,8,0.16666666666666666,5.214055122385082e-4,0.01043796442879646,"ANK2, CACNA1C, CACNA1D, CACNA2D1, CACNB2, DSC2, DSG2, KCNE1, KCNJ2, SCN5A","BIN1, CAV1, ACE, JUP, KCNJ5, KCNQ1, SCN1B, SCN4B, SRC, CACNA1G"
GO:0086064,cell communication by electrical coupling involved in cardiac conduction,1.4740314612584502,10,0.225,5.514349335036819e-4,0.03920303814177272,"CACNA1C, SLC8A1","ATP1A1, ATP1A3, ATP1B1, ATP1B2, PRKACA"
GO:0004715,non-membrane spanning protein tyrosine kinase activity,1.3637297872867296,3,0.16666666666666666,5.995410379651169e-4,0.020816808618548913,"ABL2, FER, ITK, JAK1, JAK2, LYN, PTK2, TEC, YES1","ABL1, PTK2B, FES, FGR, LCK, SRC, TYK2, ZAP70"
GO:0034237,protein kinase A regulatory subunit binding,1.684607384295372,1,0.2,6.348492653310165e-4,6.348492653310165e-4,RYR2,"KCNQ1, PRKACA, EZR"
GO:0005125,cytokine activity,0.8275264343907088,6,0.16666666666666666,8.294724408425804e-4,0.0011149613806858737,"FGF2, IFNG, IL1A, IL1B, IL5, IL7, IL15, INHBA, TNF, IL19, IL26, IL33","BMP4, NRG1, HMGB1, IL12A, IL18, INHA, INHBB, LIF, OSM, TGFB1, TIMP1, WNT1, WNT7A, GDF15, CLCF1, IL17D"
GO:0034976,response to endoplasmic reticulum stress,1.2526567729375842,1,0.14285714285714285,8.300862849467858e-4,8.300862849467858e-4,"CXCL8, MAP3K5, NCK1, PRKN, PIK3R1, RASGRF2, THBS1, EIF2AK3, ATF6, ERO1A","ATF4, ATP2A2, CEBPB, ATF6B, DDIT3, HSPA5, JUN, P4HB, RASGRF1, THBS4, HSP90B1, WFS1, XBP1, FLOT1, PPP1R15A, GORASP2, TRIB3, CREB3L3, CREB3L1"
GO:0010508,positive regulation of autophagy,1.3559035044328602,1,0.14285714285714285,0.0011901518114851176,0.0011901518114851176,"FOXO1, FOXO3, GSK3B, IFNG, MEFV, PIK3C2A, PIK3CB, PRKAA1, PRKAA2, ROCK1, ATF6, SETD2, TBK1, LRRK2, RNF152, IRGM","BAD, BNIP3, GSK3A, HMGB1, STK11, TFEB, ULK1, BECN1, SQSTM1, ATG13, OPTN, KAT5, PIM2, TPCN1, AMBRA1, TICAM1, FLCN"
GO:0016310,phosphorylation,1.0366814672586904,6,0.16666666666666666,0.0012558123598786274,0.03805722955723135,"HTR2B, PIK3CA, PIK3CB, PIK3CG, TAOK1, PANK3, LRRK2","AKT1, CDK5, PIK3CD, PRKCG, MAPK3, STAT3, LIMD1, SHPK, TOLLIP"
GO:0046777,protein autophosphorylation,1.1230715895302479,8,0.16666666666666666,0.0014002558876402913,0.02106511541043267,"ATM, ATR, CAMK2D, ERBB4, FER, GSK3B, JAK2, KDR, LYN, PDGFRA, EIF2AK2, PTK2, STK4, TXK, MAPKAPK5, EIF2AK3, SLK, SMG1, EEF2K, TAOK3, MAP3K20, TAOK1, WNK3, LRRK2","ABL1, ACVR1B, AKT1, CAD, CAMK2B, DAPK3, EPHA4, EPHB3, EPHB4, PTK2B, FES, FGFR1, FGFR4, FGR, FLT4, GRK5, IRAK1, KIT, MAP3K3, MAP3K10, MAP3K11, PDGFRB, PDPK1, PIM1, GRK1, SRC, STK11, ULK1, TAOK2, OXSR1, CAMKK2, RIPK3, MAP4K1, CHEK2, DAPK2, PRKD2, EIF2AK1, STK39, WNK2, MYLK2, SIK1, MAPK15"
GO:0005925,focal adhesion,1.1955278211128444,8,0.25,0.0014621586351849813,0.04074222539413973,"ILK, ITGA1, ITGA2, ITGAV, JAK2, PTK2, PTPRC, ADAM17, NRP1, MAP4K4, TNFSF13B, ATP6V0A2, ENAH","ACTG1, ALOX15B, ADGRB1, CAV1, CFL1, DAG1, EPHA2, PTK2B, FES, FGFR3, MSN, MYH9, MAPK3, MAP2K1, MAP2K2, PXN, RALA, SRC, TLE2, TLN1, TRIP6, VASP, EZR, ZYX, LIMD1, BCAR1, PIP5K1C, GIT1, PARVB, EVL, ASAP3"
GO:0051403,stress-activated MAPK cascade,1.2353787484832726,8,0.2857142857142857,0.001500165203309662,0.026234924123782883,"MAP3K5, MAPK8, MAP2K6, MAP3K7, MAP3K20","MAPK3, MAPK11, MAPK13, MAP2K7, TAOK2, CCM2"
GO:0001934,positive regulation of protein phosphorylation,1.0949947997919918,7,0.16666666666666666,0.0015393758205404428,0.0228873409150919,"ACVR2A, ANGPT1, FAS, CCND2, CHRNA7, ERBB4, IL1B, ILK, KDR, LYN, NTRK3, P2RY1, PTK2, STK4, TFRC, TNF, ROCK2, RASGRP1, ATG14, FNIP1, LRRK2, IRGM","ABL1, AGER, AKT1, ARRB1, CCND1, BMP4, C3, CCND3, CD4, CD74, CDKN1A, CLDN3, CSNK1D, DAXX, DVL2, DVL3, EFNA1, ERBB2, F2, FLT4, GAS6, GPER1, HLA-DRB1, HRAS, HSP90AA1, PECAM1, PIN1, PPIA, RAC1, THPO, AXIN1, AXIN2, HDAC3, FGF19, FLOT1, RACK1, CAMKK2, RALBP1, ERP29, TREM2, WNT3A, IL34, RSPO1"
